title,summary,primary_tag,tags,n_tags,primary_category,categories,author,authors,n_authors,url_pdf,url_href,date
The Whole Is Greater Than the Sum of Its Nonrigid Parts,"According to Aristotle, a philosopher in Ancient Greece, ""the whole is
greater than the sum of its parts"". This observation was adopted to explain
human perception by the Gestalt psychology school of thought in the twentieth
century. Here, we claim that observing part of an object which was previously
acquired as a whole, one could deal with both partial matching and shape
completion in a holistic manner. More specifically, given the geometry of a
full, articulated object in a given pose, as well as a partial scan of the same
object in a different pose, we address the problem of matching the part to the
whole while simultaneously reconstructing the new pose from its partial
observation. Our approach is data-driven, and takes the form of a Siamese
autoencoder without the requirement of a consistent vertex labeling at
inference time; as such, it can be used on unorganized point clouds as well as
on triangle meshes. We demonstrate the practical effectiveness of our model in
the applications of single-view deformable shape completion and dense shape
correspondence, both on synthetic and real-world geometric data, where we
outperform prior work on these tasks by a large margin.",cs.CV,"cs.LG, cs.CG, cs.CV, I.4.5",4,Computer Vision and Pattern Recognition,"Machine Learning, Computational Geometry, Computer Vision and Pattern Recognition",Ron Kimmel,"Oshri Halimi, Ido Imanuel, Or Litany, Giovanni Trappolini, Emanuele Rodolà, Leonidas Guibas, Ron Kimmel",7,http://arxiv.org/pdf/2001.09650v1,http://arxiv.org/abs/2001.09650v1,2020-01-27
"Convolution Neural Network Architecture Learning for Remote Sensing
  Scene Classification","Remote sensing image scene classification is a fundamental but challenging
task in understanding remote sensing images. Recently, deep learning-based
methods, especially convolutional neural network-based (CNN-based) methods have
shown enormous potential to understand remote sensing images. CNN-based methods
meet with success by utilizing features learned from data rather than features
designed manually. The feature-learning procedure of CNN largely depends on the
architecture of CNN. However, most of the architectures of CNN used for remote
sensing scene classification are still designed by hand which demands a
considerable amount of architecture engineering skills and domain knowledge,
and it may not play CNN's maximum potential on a special dataset. In this
paper, we proposed an automatically architecture learning procedure for remote
sensing scene classification. We designed a parameters space in which every set
of parameters represents a certain architecture of CNN (i.e., some parameters
represent the type of operators used in the architecture such as convolution,
pooling, no connection or identity, and the others represent the way how these
operators connect). To discover the optimal set of parameters for a given
dataset, we introduced a learning strategy which can allow efficient search in
the architecture space by means of gradient descent. An architecture generator
finally maps the set of parameters into the CNN used in our experiments.",cs.CV,cs.CV,1,Computer Vision and Pattern Recognition,Computer Vision and Pattern Recognition,Haifeng Li,"Jie Chen, Haozhe Huang, Jian Peng, Jiawei Zhu, Li Chen, Wenbo Li, Binyu Sun, Haifeng Li",8,http://arxiv.org/pdf/2001.09614v1,http://arxiv.org/abs/2001.09614v1,2020-01-27
"Practical Fast Gradient Sign Attack against Mammographic Image
  Classifier","Artificial intelligence (AI) has been a topic of major research for many
years. Especially, with the emergence of deep neural network (DNN), these
studies have been tremendously successful. Today machines are capable of making
faster, more accurate decision than human. Thanks to the great development of
machine learning (ML) techniques, ML have been used many different fields such
as education, medicine, malware detection, autonomous car etc. In spite of
having this degree of interest and much successful research, ML models are
still vulnerable to adversarial attacks. Attackers can manipulate clean data in
order to fool the ML classifiers to achieve their desire target. For instance;
a benign sample can be modified as a malicious sample or a malicious one can be
altered as benign while this modification can not be recognized by human
observer. This can lead to many financial losses, or serious injuries, even
deaths. The motivation behind this paper is that we emphasize this issue and
want to raise awareness. Therefore, the security gap of mammographic image
classifier against adversarial attack is demonstrated. We use mamographic
images to train our model then evaluate our model performance in terms of
accuracy. Later on, we poison original dataset and generate adversarial samples
that missclassified by the model. We then using structural similarity index
(SSIM) analyze similarity between clean images and adversarial images. Finally,
we show how successful we are to misuse by using different poisoning factors.",cs.CV,"cs.LG, stat.ML, eess.IV, cs.CV",4,Computer Vision and Pattern Recognition,"Machine Learning, Machine Learning, Image and Video Processing, Computer Vision and Pattern Recognition",Ibrahim Yilmaz,Ibrahim Yilmaz,1,http://arxiv.org/pdf/2001.09610v1,http://arxiv.org/abs/2001.09610v1,2020-01-27
"FakeLocator: Robust Localization of GAN-Based Face Manipulations via
  Semantic Segmentation Networks with Bells and Whistles","Nowadays, full face synthesis and partial face manipulation by virtue of the
generative adversarial networks (GANs) have raised wide public concern. In the
digital media forensics area, detecting and ultimately locating the image
forgery have become imperative. Although many methods focus on fake detection,
only a few put emphasis on the localization of the fake regions. Through
analyzing the imperfection in the upsampling procedures of the GAN-based
methods and recasting the fake localization problem as a modified semantic
segmentation one, our proposed FakeLocator can obtain high localization
accuracy, at full resolution, on manipulated facial images. To the best of our
knowledge, this is the very first attempt to solve the GAN-based fake
localization problem with a semantic segmentation map. As an improvement, the
real-numbered segmentation map proposed by us preserves more information of
fake regions. For this new type segmentation map, we also find suitable loss
functions for it. Experimental results on the CelebA and FFHQ databases with
seven different SOTA GAN-based face generation methods show the effectiveness
of our method. Compared with the baseline, our method performs several times
better on various metrics. Moreover, the proposed method is robust against
various real-world facial image degradations such as JPEG compression,
low-resolution, noise, and blur.",cs.CV,"cs.LG, cs.CV",2,Computer Vision and Pattern Recognition,"Machine Learning, Computer Vision and Pattern Recognition",Geguang Pu,"Yihao Huang, Felix Juefei-Xu, Run Wang, Xiaofei Xie, Lei Ma, Jianwen Li, Weikai Miao, Yang Liu, Geguang Pu",9,http://arxiv.org/pdf/2001.09598v1,http://arxiv.org/abs/2001.09598v1,2020-01-27
"Genetic Programming for Evolving a Front of Interpretable Models for
  Data Visualisation","Data visualisation is a key tool in data mining for understanding big
datasets. Many visualisation methods have been proposed, including the
well-regarded state-of-the-art method t-Distributed Stochastic Neighbour
Embedding. However, the most powerful visualisation methods have a significant
limitation: the manner in which they create their visualisation from the
original features of the dataset is completely opaque. Many domains require an
understanding of the data in terms of the original features; there is hence a
need for powerful visualisation methods which use understandable models. In
this work, we propose a genetic programming approach named GPtSNE for evolving
interpretable mappings from a dataset to highquality visualisations. A
multi-objective approach is designed that produces a variety of visualisations
in a single run which give different trade-offs between visual quality and
model complexity. Testing against baseline methods on a variety of datasets
shows the clear potential of GP-tSNE to allow deeper insight into data than
that provided by existing visualisation methods. We further highlight the
benefits of a multi-objective approach through an in-depth analysis of a
candidate front, which shows how multiple models can",cs.NE,"cs.CV, cs.NE",2,Neural and Evolutionary Computing,"Computer Vision and Pattern Recognition, Neural and Evolutionary Computing",Mengjie Zhang,"Andrew Lensen, Bing Xue, Mengjie Zhang",3,http://arxiv.org/pdf/2001.09578v1,http://arxiv.org/abs/2001.09578v1,2020-01-27
Improved quantum circuits for elliptic curve discrete logarithms,"We present improved quantum circuits for elliptic curve scalar
multiplication, the most costly component in Shor's algorithm to compute
discrete logarithms in elliptic curve groups. We optimize low-level components
such as reversible integer and modular arithmetic through windowing techniques
and more adaptive placement of uncomputing steps, and improve over previous
quantum circuits for modular inversion by reformulating the binary Euclidean
algorithm. Overall, we obtain an affine Weierstrass point addition circuit that
has lower depth and uses fewer $T$ gates than previous circuits. While previous
work mostly focuses on minimizing the total number of qubits, we present
various trade-offs between different cost metrics including the number of
qubits, circuit depth and $T$-gate count. Finally, we provide a full
implementation of point addition in the Q# quantum programming language that
allows unit tests and automatic quantum resource estimation for all components.",quant-ph,"cs.ET, quant-ph",2,Quantum Physics,"Emerging Technologies, Quantum Physics",Mathias Soeken,"Thomas Häner, Samuel Jaques, Michael Naehrig, Martin Roetteler, Mathias Soeken",5,http://arxiv.org/pdf/2001.09580v1,http://arxiv.org/abs/2001.09580v1,2020-01-27
Towards a Human-like Open-Domain Chatbot,"We present Meena, a multi-turn open-domain chatbot trained end-to-end on data
mined and filtered from public domain social media conversations. This 2.6B
parameter neural network is trained to minimize perplexity, an automatic metric
that we compare against human judgement of multi-turn conversation quality. To
capture this judgement, we propose a human evaluation metric called
Sensibleness and Specificity Average (SSA), which captures key elements of good
conversation. Interestingly, our experiments show strong correlation between
perplexity and SSA. The fact that the best perplexity end-to-end trained Meena
scores high on SSA (72% on multi-turn evaluation) suggests that a human-level
SSA of 86% is potentially within reach if we can better optimize perplexity.
Additionally, the full version of Meena (with a filtering mechanism and tuned
decoding) scores 79% SSA, 23% higher than the next highest scoring chatbot that
we evaluated.",cs.CL,"cs.LG, stat.ML, cs.CL, cs.NE",4,Computation and Language,"Machine Learning, Machine Learning, Computation and Language, Neural and Evolutionary Computing",Quoc V. Le,"Daniel Adiwardana, Minh-Thang Luong, David R. So, Jamie Hall, Noah Fiedel, Romal Thoppilan, Zi Yang, Apoorv Kulshreshtha, Gaurav Nemade, Yifeng Lu, Quoc V. Le",11,http://arxiv.org/pdf/2001.09977v1,http://arxiv.org/abs/2001.09977v1,2020-01-27
"Reinforcement Learning-based Autoscaling of Workflows in the Cloud: A
  Survey","Reinforcement Learning (RL) has demonstrated a great potential for
automatically solving decision making problems in complex uncertain
environments. Basically, RL proposes a computational approach that allows
learning through interaction in an environment of stochastic behavior, with
agents taking actions to maximize some cumulative short-term and long-term
rewards. Some of the most impressive results have been shown in Game Theory
where agents exhibited super-human performance in games like Go or Starcraft 2,
which led to its adoption in many other domains including Cloud Computing.
Particularly, workflow autoscaling exploits the Cloud elasticity to optimize
the execution of workflows according to a given optimization criteria. This is
a decision-making problem in which it is necessary to establish when and how to
scale-up/down computational resources; and how to assign them to the upcoming
processing workload. Such actions have to be taken considering some
optimization criteria in the Cloud, a dynamic and uncertain environment.
Motivated by this, many works apply RL to the autoscaling problem in Cloud. In
this work we survey exhaustively those proposals from major venues, and
uniformly compare them based on a set of proposed taxonomies. We also discuss
open problems and provide a prospective of future research in the area.",cs.DC,"cs.LG, C.2.4; I.2.6; I.2.11, stat.ML, cs.DC",4,"Distributed, Parallel, and Cluster Computing","Machine Learning, Machine Learning, Distributed, Parallel, and Cluster Computing",Carlos García Garino,"Yisel Garí, David A. Monge, Elina Pacini, Cristian Mateos, Carlos García Garino",5,http://arxiv.org/pdf/2001.09957v1,http://arxiv.org/abs/2001.09957v1,2020-01-27
"A Precision Medicine Approach to Develop and Internally Validate Optimal
  Exercise and Weight Loss Treatments for Overweight and Obese Adults with Knee
  Osteoarthritis","We proposed a precision medicine approach to determine the optimal treatment
regime for participants in an exercise (E), dietary weight loss (D), and D+E
trial for knee osteoarthritis (KOA) that would have maximized their expected
outcomes. Using data from 343 participants of the Intensive Diet and Exercise
for Arthritis (IDEA) trial, we applied 24 machine-learning models to develop
individualized treatment rules on seven outcomes: SF-36 physical component
score, weight loss, WOMAC pain/function/stiffness scores, compressive force,
and IL-6. The optimal model was selected based on jackknife value function
estimates that indicate improvement in the outcome(s) if future participants
follow the estimated decision rule compared against the optimal single, fixed
treatment model. Multiple outcome random forest was the optimal model for the
WOMAC outcomes. For the other outcomes, list-based models were optimal. For
example, the estimated optimal decision rule for weight loss assigns the D+E
intervention to participants with baseline weight not exceeding 109.35 kg and
waist circumference above 90.25 cm, and assigns D to all other participants
except those with history of a heart attack. If applied to future participants,
the optimal rule for weight loss is estimated to increase average weight loss
to 11.2 kg at 18 months, contrasted with 9.8 kg if all received D+E (p = 0.01).
The precision medicine models supported the overall findings from IDEA that the
D+E intervention was optimal for most participants, but there was evidence that
a subgroup of participants would likely benefit more from diet alone for two
outcomes.",stat.ML,"cs.LG, stat.AP, stat.ML",3,Machine Learning,"Machine Learning, Applications, Machine Learning",Michael R. Kosorok,"Xiaotong Jiang, Amanda E. Nelson, Rebecca J. Cleveland, Daniel P. Beavers, Todd A. Schwartz, Liubov Arbeeva, Carolina Alvarez, Leigh F. Callahan, Stephen Messier, Richard Loeser, Michael R. Kosorok",11,http://arxiv.org/pdf/2001.09930v1,http://arxiv.org/abs/2001.09930v1,2020-01-27
"Predicting Yield Performance of Parents in Plant Breeding: A Neural
  Collaborative Filtering Approach","Experimental corn hybrids are created in plant breeding programs by crossing
two parents, so-called inbred and tester, together. Identification of best
parent combinations for crossing is challenging since the total number of
possible cross combinations of parents is large and it is impractical to test
all possible cross combinations due to limited resources of time and budget. In
the 2020 Syngenta Crop Challenge, Syngenta released several large datasets that
recorded the historical yield performances of around 4% of total cross
combinations of 593 inbreds with 496 testers which were planted in 280
locations between 2016 and 2018 and asked participants to predict the yield
performance of cross combinations of inbreds and testers that have not been
planted based on the historical yield data collected from crossing other
inbreds and testers. In this paper, we present a collaborative filtering method
which is an ensemble of matrix factorization method and neural networks to
solve this problem. Our computational results suggested that the proposed model
significantly outperformed other models such as LASSO, random forest (RF), and
neural networks. Presented method and results were produced within the 2020
Syngenta Crop Challenge.",cs.LG,"cs.LG, stat.AP, stat.ML, q-bio.QM",4,Machine Learning,"Machine Learning, Applications, Machine Learning, Quantitative Methods",Lizhi Wang,"Saeed Khaki, Zahra Khalilzadeh, Lizhi Wang",3,http://arxiv.org/pdf/2001.09902v1,http://arxiv.org/abs/2001.09902v1,2020-01-27
"Estimating heterogeneous treatment effects with right-censored data via
  causal survival forests","There is fast-growing literature on estimating heterogeneous treatment
effects via random forests in observational studies. However, there are few
approaches available for right-censored survival data. In clinical trials,
right-censored survival data are frequently encountered. Quantifying the causal
relationship between a treatment and the survival outcome is of great interest.
Random forests provide a robust, nonparametric approach to statistical
estimation. In addition, recent developments allow forest-based methods to
quantify the uncertainty of the estimated heterogeneous treatment effects. We
propose causal survival forests that directly target on estimating the
treatment effect from an observational study. We establish consistency and
asymptotic normality of the proposed estimators and provide an estimator of the
asymptotic variance that enables valid confidence intervals of the estimated
treatment effect. The performance of our approach is demonstrated via extensive
simulations and data from an HIV study.",stat.ME,"stat.ME, stat.ML, 62N01, cs.LG",4,Methodology,"Methodology, Machine Learning, Machine Learning",Ruoqing Zhu,"Yifan Cui, Michael R. Kosorok, Stefan Wager, Ruoqing Zhu",4,http://arxiv.org/pdf/2001.09887v1,http://arxiv.org/abs/2001.09887v1,2020-01-27
Bayesian nonparametric shared multi-sequence time series segmentation,"In this paper, we introduce a method for segmenting time series data using
tools from Bayesian nonparametrics. We consider the task of temporal
segmentation of a set of time series data into representative stationary
segments. We use Gaussian process (GP) priors to impose our knowledge about the
characteristics of the underlying stationary segments, and use a nonparametric
distribution to partition the sequences into such segments, formulated in terms
of a prior distribution on segment length. Given the segmentation, the model
can be viewed as a variant of a Gaussian mixture model where the mixture
components are described using the covariance function of a GP. We demonstrate
the effectiveness of our model on synthetic data as well as on real time-series
data of heartbeats where the task is to segment the indicative types of beats
and to classify the heartbeat recordings into classes that correspond to
healthy and abnormal heart sounds.",cs.LG,"cs.LG, stat.ML",2,Machine Learning,"Machine Learning, Machine Learning",Carl Henrik Ek,"Olga Mikheeva, Ieva Kazlauskaite, Hedvig Kjellström, Carl Henrik Ek",4,http://arxiv.org/pdf/2001.09886v1,http://arxiv.org/abs/2001.09886v1,2020-01-27
Efficient and Stable Graph Scattering Transforms via Pruning,"Graph convolutional networks (GCNs) have well-documented performance in
various graph learning tasks, but their analysis is still at its infancy. Graph
scattering transforms (GSTs) offer training-free deep GCN models that extract
features from graph data, and are amenable to generalization and stability
analyses. The price paid by GSTs is exponential complexity in space and time
that increases with the number of layers. This discourages deployment of GSTs
when a deep architecture is needed. The present work addresses the complexity
limitation of GSTs by introducing an efficient so-termed pruned (p)GST
approach. The resultant pruning algorithm is guided by a
graph-spectrum-inspired criterion, and retains informative scattering features
on-the-fly while bypassing the exponential complexity associated with GSTs.
Stability of the novel pGSTs is also established when the input graph data or
the network structure are perturbed. Furthermore, the sensitivity of pGST to
random and localized signal perturbations is investigated analytically and
experimentally. Numerical tests showcase that pGST performs comparably to the
baseline GST at considerable computational savings. Furthermore, pGST achieves
comparable performance to state-of-the-art GCNs in graph and 3D point cloud
classification tasks. Upon analyzing the pGST pruning patterns, it is shown
that graph data in different domains call for different network architectures,
and that the pruning algorithm may be employed to guide the design choices for
contemporary GCNs.",eess.SP,"cs.LG, cs.SI, eess.SP",3,Signal Processing,"Machine Learning, Social and Information Networks, Signal Processing",Georgios B. Giannakis,"Vassilis N. Ioannidis, Siheng Chen, Georgios B. Giannakis",3,http://arxiv.org/pdf/2001.09882v1,http://arxiv.org/abs/2001.09882v1,2020-01-27
Identification of Non-Linear RF Systems Using Backpropagation,"In this work, we use deep unfolding to view cascaded non-linear RF systems as
model-based neural networks. This view enables the direct use of a wide range
of neural network tools and optimizers to efficiently identify such cascaded
models. We demonstrate the effectiveness of this approach through the example
of digital self-interference cancellation in full-duplex communications where
an IQ imbalance model and a non-linear PA model are cascaded in series. For a
self-interference cancellation performance of approximately 44.5 dB, the number
of model parameters can be reduced by 74% and the number of operations per
sample can be reduced by 79% compared to an expanded linear-in-parameters
polynomial model.",eess.SP,"cs.LG, eess.SP",2,Signal Processing,"Machine Learning, Signal Processing",Alexios Balatsoukas-Stimming,"Andreas Toftegaard Kristensen, Andreas Burg, Alexios Balatsoukas-Stimming",3,http://arxiv.org/pdf/2001.09877v1,http://arxiv.org/abs/2001.09877v1,2020-01-27
"The POLAR Framework: Polar Opposites Enable Interpretability of
  Pre-Trained Word Embeddings","We introduce POLAR - a framework that adds interpretability to pre-trained
word embeddings via the adoption of semantic differentials. Semantic
differentials are a psychometric construct for measuring the semantics of a
word by analysing its position on a scale between two polar opposites (e.g.,
cold -- hot, soft -- hard). The core idea of our approach is to transform
existing, pre-trained word embeddings via semantic differentials to a new
""polar"" space with interpretable dimensions defined by such polar opposites.
Our framework also allows for selecting the most discriminative dimensions from
a set of polar dimensions provided by an oracle, i.e., an external source. We
demonstrate the effectiveness of our framework by deploying it to various
downstream tasks, in which our interpretable word embeddings achieve a
performance that is comparable to the original word embeddings. We also show
that the interpretable dimensions selected by our framework align with human
judgement. Together, these results demonstrate that interpretability can be
added to word embeddings without compromising performance. Our work is relevant
for researchers and engineers interested in interpreting pre-trained word
embeddings.",cs.CL,"cs.LG, stat.ML, cs.CL",3,Computation and Language,"Machine Learning, Machine Learning, Computation and Language",Markus Strohmaier,"Binny Mathew, Sandipan Sikdar, Florian Lemmerich, Markus Strohmaier",4,http://arxiv.org/pdf/2001.09876v1,http://arxiv.org/abs/2001.09876v1,2020-01-27
Exploiting Unsupervised Inputs for Accurate Few-Shot Classification,"In few-shot classification, the aim is to learn models able to discriminate
classes with only a small number of labelled examples. Most of the literature
considers the problem of labelling a single unknown input at a time. Instead,
it can be beneficial to consider a setting where a batch of unlabelled inputs
are treated conjointly and non-independently. In this paper, we propose a
method able to exploit three levels of information: a) feature extractors
pretrained on generic datasets, b) few labelled examples of classes to
discriminate and c) other available unlabelled inputs. If for a), we use
state-of-the-art approaches, we introduce the use of simplified graph
convolutions to perform b) and c) together. Our proposed model reaches
state-of-the-art accuracy with a $6-11\%$ increase compared to available
alternatives on standard few-shot vision classification datasets.",cs.LG,"cs.LG, stat.ML",2,Machine Learning,"Machine Learning, Machine Learning",Stéphane Pateux,"Yuqing Hu, Vincent Gripon, Stéphane Pateux",3,http://arxiv.org/pdf/2001.09849v1,http://arxiv.org/abs/2001.09849v1,2020-01-27
