title,summary,primary_tag,tags,n_tags,primary_category,categories,author,authors,n_authors,url_pdf,url_href,date
Polygames: Improved Zero Learning,"Since DeepMind's AlphaZero, Zero learning quickly became the state-of-the-art
method for many board games. It can be improved using a fully convolutional
structure (no fully connected layer). Using such an architecture plus global
pooling, we can create bots independent of the board size. The training can be
made more robust by keeping track of the best checkpoints during the training
and by training against them. Using these features, we release Polygames, our
framework for Zero learning, with its library of games and its checkpoints. We
won against strong humans at the game of Hex in 19x19, which was often said to
be untractable for zero learning; and in Havannah. We also won several first
places at the TAAI competitions.",cs.LG,"cs.LG, stat.ML",2,Machine Learning,"Machine Learning, Machine Learning",Sergey Zagoruyko,"Tristan Cazenave, Yen-Chi Chen, Guan-Wei Chen, Shi-Yu Chen, Xian-Dong Chiu, Julien Dehos, Maria Elsa, Qucheng Gong, Hengyuan Hu, Vasil Khalidov, Cheng-Ling Li, Hsin-I Lin, Yu-Jin Lin, Xavier Martinet, Vegard Mella, Jeremy Rapin, Baptiste Roziere, Gabriel Synnaeve, Fabien Teytaud, Olivier Teytaud, Shi-Cheng Ye, Yi-Jun Ye, Shi-Jim Yen, Sergey Zagoruyko",24,http://arxiv.org/pdf/2001.09832v1,http://arxiv.org/abs/2001.09832v1,2020-01-27
Uncertainty-based Modulation for Lifelong Learning,"The creation of machine learning algorithms for intelligent agents capable of
continuous, lifelong learning is a critical objective for algorithms being
deployed on real-life systems in dynamic environments. Here we present an
algorithm inspired by neuromodulatory mechanisms in the human brain that
integrates and expands upon Stephen Grossberg\'s ground-breaking Adaptive
Resonance Theory proposals. Specifically, it builds on the concept of
uncertainty, and employs a series of neuromodulatory mechanisms to enable
continuous learning, including self-supervised and one-shot learning. Algorithm
components were evaluated in a series of benchmark experiments that demonstrate
stable learning without catastrophic forgetting. We also demonstrate the
critical role of developing these systems in a closed-loop manner where the
environment and the agent\'s behaviors constrain and guide the learning
process. To this end, we integrated the algorithm into an embodied simulated
drone agent. The experiments show that the algorithm is capable of continuous
learning of new tasks and under changed conditions with high classification
accuracy (greater than 94 percent) in a virtual environment, without
catastrophic forgetting. The algorithm accepts high dimensional inputs from any
state-of-the-art detection and feature extraction algorithms, making it a
flexible addition to existing systems. We also describe future development
efforts focused on imbuing the algorithm with mechanisms to seek out new
knowledge as well as employ a broader range of neuromodulatory processes.",cs.LG,"cs.LG, stat.ML",2,Machine Learning,"Machine Learning, Machine Learning",Mario Aguilar-Simon,"Andrew Brna, Ryan Brown, Patrick Connolly, Stephen Simons, Renee Shimizu, Mario Aguilar-Simon",6,http://arxiv.org/pdf/2001.09822v1,http://arxiv.org/abs/2001.09822v1,2020-01-27
The Apiza Corpus: API Usage Dialogues with a Simulated Virtual Assistant,"Virtual assistant technology has the potential to make a significant impact
in the field of software engineering. However, few SE-related datasets exist
that would be suitable for the design or training of a virtual assistant. To
help lay the groundwork for a hypothetical virtual assistant for API usage, we
designed and conducted a Wizard-of-Oz study to gather this crucial data. We
hired 30 professional programmers to complete a series of programming tasks by
interacting with a simulated virtual assistant. Unbeknownst to the programmers,
the virtual assistant was actually operated by another human expert. In this
report, we describe our experimental methodology and summarize the results of
the study.",cs.SE,"cs.SE, cs.HC",2,Software Engineering,"Software Engineering, Human-Computer Interaction",Collin McMillan,"Zachary Eberhart, Aakash Bansal, Collin McMillan",3,http://arxiv.org/pdf/2001.09925v1,http://arxiv.org/abs/2001.09925v1,2020-01-27
Verifying Software Vulnerabilities in IoT Cryptographic Protocols,"Internet of Things (IoT) is a system that consists of a large number of smart
devices connected through a network. The number of these devices is increasing
rapidly, which creates a massive and complex network with a vast amount of data
communicated over that network. One way to protect this data in transit, i.e.,
to achieve data confidentiality, is to use lightweight encryption algorithms
for IoT protocols. However, the design and implementation of such protocols is
an error-prone task; flaws in the implementation can lead to devastating
security vulnerabilities. These vulnerabilities can be exploited by an attacker
and affect users' privacy. There exist various techniques to verify software
and detect vulnerabilities. Bounded Model Checking (BMC) and Fuzzing are useful
techniques to check the correctness of a software system concerning its
specifications. Here we describe a framework called Encryption-BMC and Fuzzing
(EBF) using combined BMC and fuzzing techniques. We evaluate the application of
EBF verification framework on a case study, i.e., the S-MQTT protocol, to check
security vulnerabilities in cryptographic protocols for IoT.",cs.CR,"cs.CR, cs.SE",2,Cryptography and Security,"Cryptography and Security, Software Engineering",Mustafa A. Mustafa,"Fatimah Aljaafari, Lucas C. Cordeiro, Mustafa A. Mustafa",3,http://arxiv.org/pdf/2001.09837v1,http://arxiv.org/abs/2001.09837v1,2020-01-27
Ammonia: An Approach for Deriving Project-specific Bug Patterns,"Finding and fixing buggy code is an important and cost-intensive maintenance
task, and static analysis (SA) is one of the methods developers use to perform
it. SA tools warn developers about potential bugs by scanning their source code
for commonly occurring bug patterns, thus giving those developers opportunities
to fix the warnings (potential bugs) before they release the software.
Typically, SA tools scan for general bug patterns that are common to any
software project (such as null pointer dereference), and not for project
specific patterns. However, past research has pointed to this lack of
customizability as a severe limiting issue in SA. Accordingly, in this paper,
we propose an approach called Ammonia, which is based on statically analyzing
changes across the development history of a project, as a means to identify
project-specific bug patterns. Furthermore, the bug patterns identified by our
tool do not relate to just one developer or one specific commit, they reflect
the project as a whole and compliment the warnings from other SA tools that
identify general bug patterns. Herein, we report on the application of our
implemented tool and approach to four Java projects: Ant, Camel, POI, and
Wicket. The results obtained show that our tool could detect 19 project
specific bug patterns across those four projects. Next, through manual
analysis, we determined that six of those change patterns were actual bugs and
submitted pull requests based on those bug patterns. As a result, five of the
pull requests were merged.",cs.SE,cs.SE,1,Software Engineering,Software Engineering,Meiyappan Nagappan,"Yoshiki Higo, Shinpei Hayashi, Hideaki Hata, Meiyappan Nagappan",4,http://arxiv.org/pdf/2001.09630v1,http://arxiv.org/abs/2001.09630v1,2020-01-27
"Risk Fluctuation Characteristics of Internet Finance: Combining Industry
  Characteristics with Ecological Value","The Internet plays a key role in society and is vital to economic
development. Due to the pressure of competition, most technology companies,
including Internet finance companies, continue to explore new markets and new
business. Funding subsidies and resource inputs have led to significant
business income tendencies in financial statements. This tendency of business
income is often manifested as part of the business loss or long-term
unprofitability. We propose a risk change indicator (RFR) and compare the risk
indicator of fourteen representative companies. This model combines extreme
risk value with slope, and the combination method is simple and effective. The
results of experiment show the potential of this model. The risk volatility of
technology enterprises including Internet finance enterprises is highly
cyclical, and the risk volatility of emerging Internet fintech companies is
much higher than that of other technology companies.",econ.EM,econ.EM,1,Econometrics,Econometrics,Hefan Shuai,"Runjie Xu, Chuanmin Mi, Nan Ye, Tom Marshall, Yadong Xiao, Hefan Shuai",6,http://arxiv.org/pdf/2001.09798v1,http://arxiv.org/abs/2001.09798v1,2020-01-27
"Estimating Marginal Treatment Effects under Unobserved Group
  Heterogeneity","This paper studies endogenous treatment effect models in which individuals
are classified into unobserved groups based on heterogeneous treatment choice
rules. Such heterogeneity may arise, for example, when multiple treatment
eligibility criteria and different preference patterns exist. Using a finite
mixture approach, we propose a marginal treatment effect (MTE) framework in
which the treatment choice and outcome equations can be heterogeneous across
groups. Under the availability of valid instrumental variables specific to each
group, we show that the MTE for each group can be separately identified using
the local instrumental variable method. Based on our identification result, we
propose a two-step semiparametric procedure for estimating the group-wise MTE
parameters. We first estimate the finite-mixture treatment choice model by a
maximum likelihood method and then estimate the MTEs using a series
approximation method. We prove that the proposed MTE estimator is consistent
and asymptotically normally distributed. We illustrate the usefulness of the
proposed method with an application to economic returns to college education.",econ.EM,"stat.ME, econ.EM",2,Econometrics,"Methodology, Econometrics",Takahide Yanagi,"Tadao Hoshino, Takahide Yanagi",2,http://arxiv.org/pdf/2001.09560v1,http://arxiv.org/abs/2001.09560v1,2020-01-27
"Predictive inference with Fleming--Viot-driven dependent Dirichlet
  processes","We consider predictive inference using a class of temporally dependent
Dirichlet processes driven by Fleming--Viot diffusions, which have a natural
bearing in Bayesian nonparametrics and lend the resulting family of random
probability measures to analytical posterior analysis. Formulating the implied
statistical model as a hidden Markov model, we fully describe the predictive
distribution induced by these Fleming--Viot-driven dependent Dirichlet
processes, for a sequence of observations collected at a certain time given
another set of draws collected at several previous times. This is identified as
a mixture of P\'olya urns, whereby the observations can be values from the
baseline distribution or copies of previous draws collected at the same time as
in the usual P\`olya urn, or can be sampled from a random subset of the data
collected at previous times. We characterise the time-dependent weights of the
mixture which select such subsets and discuss the asymptotic regimes. We
describe the induced partition by means of a Chinese restaurant process
metaphor with a conveyor belt, whereby new customers who do not sit at an
occupied table open a new table by picking a dish either from the baseline
distribution or from a time-varying offer available on the conveyor belt. We
lay out explicit algorithms for exact and approximate posterior sampling of
both observations and partitions, and illustrate our results on predictive
problems with synthetic and real data.",stat.ME,"stat.ME, stat.TH, math.ST, 62F15",4,Methodology,"Methodology, Statistics Theory, Statistics Theory",Matteo Ruggiero,"Filippo Ascolani, Antonio Lijoi, Matteo Ruggiero",3,http://arxiv.org/pdf/2001.09868v1,http://arxiv.org/abs/2001.09868v1,2020-01-27
"Exact rate of convergence of the mean Wasserstein distance between the
  empirical and true Gaussian distribution","We study the Wasserstein distance $W_2$ for Gaussian samples. We establish
the exact rate of convergence $\sqrt{\log\log n/n}$ of the expected value of
the $W_2$ distance between the empirical and true $c.d.f.$'s for the normal
distribution. We also show that the rate of weak convergence is unexpectedly
$1/\sqrt{n}$ in the case of two correlated Gaussian samples.",math.PR,"stat.TH, math.ST, math.PR",3,Probability,"Statistics Theory, Statistics Theory, Probability",Jean-Claude Fort,"Philippe Berthet, Jean-Claude Fort",2,http://arxiv.org/pdf/2001.09817v1,http://arxiv.org/abs/2001.09817v1,2020-01-27
Bayesian Shrinkage Estimation of Negative Multinomial Parameter Vectors,"The negative multinomial distribution is a multivariate generalization of the
negative binomial distribution. In this paper, we consider the problem of
estimating an unknown matrix of probabilities on the basis of observations of
negative multinomial variables under the standardized squared error loss.
First, a general sufficient condition for a shrinkage estimator to dominate the
UMVU estimator is derived and an empirical Bayes estimator satisfying the
condition is constructed. Next, a hierarchical shrinkage prior is introduced,
an associated Bayes estimator is shown to dominate the UMVU estimator under
some conditions, and some remarks about posterior computation are presented.
Finally, shrinkage estimators and the UMVU estimator are compared by
simulation.",math.ST,"stat.ME, stat.TH, math.ST",3,Statistics Theory,"Methodology, Statistics Theory, Statistics Theory",Tatsuya Kubokawa,"Yasuyuki Hamura, Tatsuya Kubokawa",2,http://arxiv.org/pdf/2001.09602v1,http://arxiv.org/abs/2001.09602v1,2020-01-27
"SAAMPLE: A Segregated Accuracy-driven Algorithm for Multiphase
  Pressure-Linked Equations","Existing hybrid Level Set / Front Tracking methods have been developed for
structured meshes and successfully used for efficient and accurate simulations
of complex multiphase flows. This contribution extends the capability of hybrid
Level Set / Front Tracking methods towards handling surface tension driven
multiphase flows using unstructured meshes. Unstructured meshes are
traditionally used in Computational Fluid Dynamics to handle geometrically
complex problems. In order to simulate surface-tension driven multiphase flows
on unstructured meshes, a new SAAMPLE Segregated Accuracy-driven Algorithm for
Multiphase Pressure-Linked Equations is proposed, that increases the robustness
of the unstructured Level Set / Front Tracking (LENT) method. The LENT method
is implemented in the Open- FOAM open source code for Computational Fluid
Dynamics.",physics.comp-ph,"physics.flu-dyn, physics.comp-ph",2,Computational Physics,"Fluid Dynamics, Computational Physics",Tomislav Maric,"Tobias Tolle, Dieter Bothe, Tomislav Maric",3,http://arxiv.org/pdf/2001.09775v1,http://arxiv.org/abs/2001.09775v1,2020-01-27
"First-principles-based calculation of branching ratio for
  5$\boldsymbol{d}$, 4$\boldsymbol{d}$, and 3$\boldsymbol{d}$ transition metal
  systems","A new first-principles computation scheme to calculate `branching ratio' has
been applied to various $5d$, $4d$, and $3d$ transition metal elements and
compounds. This recently suggested method is based on a theory which assumes
the atomic core hole interacting barely with valence electrons. While it
provides an efficient way to calculate the experimentally measurable quantity
without generating spectrum itself, its reliability and applicability should be
carefully examined especially for the light transition metal systems. Here we
select 36 different materials and compare the calculation results with
experimental data. It is found that our scheme well describes 5$d$ and 4$d$
transition metal systems whereas, for 3$d$ materials, the difference between
the calculation and experiment is quite significant. It is attributed to the
neglect of core-valence interaction whose energy scale is comparable with the
spin-orbit coupling of core $p$ orbitals.",cond-mat.str-el,"cond-mat.str-el, physics.comp-ph",2,Strongly Correlated Electrons,"Strongly Correlated Electrons, Computational Physics",Myung Joon Han,"Do Hoon Kiem, Jae-Hoon Sim, Hongkee Yoon, Myung Joon Han",4,http://arxiv.org/pdf/2001.09713v1,http://arxiv.org/abs/2001.09713v1,2020-01-27
Assessment of supervised machine learning methods for fluid flows,"We apply supervised machine learning techniques to a number of regression
problems in fluid dynamics. Four machine learning architectures are examined in
terms of their characteristics, accuracy, computational cost, and robustness
for canonical flow problems. We consider the estimation of force coefficients
and wakes from a limited number of sensors on the surface for flows over a
cylinder and NACA0012 airfoil with a Gurney flap. The influence of the temporal
density of the training data is also examined. Furthermore, we consider the use
of convolutional neural network in the context of super-resolution analysis of
two-dimensional cylinder wake, two-dimensional decaying isotropic turbulence,
and three-dimensional turbulent channel flow. In the concluding remarks, we
summarize on findings from a range of regression type problems considered
herein.",physics.flu-dyn,"physics.flu-dyn, physics.comp-ph",2,Fluid Dynamics,"Fluid Dynamics, Computational Physics",Kunihiko Taira,"Kai Fukami, Koji Fukagata, Kunihiko Taira",3,http://arxiv.org/pdf/2001.09618v1,http://arxiv.org/abs/2001.09618v1,2020-01-27
Ballistic Properties of Highly Stretchable Graphene Kirigami Pyramid,"Graphene kirigami (patterned cuts) can be an effective way to improve some of
the graphene mechanical and electronic properties. In this work, we report the
first study of the mechanical and ballistic behavior of single and multilayered
graphene pyramid kirigami (GKP). We have carriedout fully atomistic reactive
molecular dynamics simulations. GPK presents a unique kinetic energy absorption
due to its topology that creates multi-steps dissipation mechanisms, which
block crack propagation. Our results show that even having significantly less
mass, GKP can outperform graphene structures with similar dimensions in terms
of absorbing kinetic energy.",cond-mat.mtrl-sci,"physics.comp-ph, cond-mat.mes-hall, cond-mat.mtrl-sci",3,Materials Science,"Computational Physics, Mesoscale and Nanoscale Physics, Materials Science",Pedro Alves da Silva Autreto,"Alirio Moura, Douglas S. Galvao, Pedro Alves da Silva Autreto",3,http://arxiv.org/pdf/2001.09546v1,http://arxiv.org/abs/2001.09546v1,2020-01-27
"Machine learning applied to simulations of collisions between rotating,
  differentiated planets","In the late stages of terrestrial planet formation, pairwise collisions
between planetary-sized bodies act as the fundamental agent of planet growth.
These collisions can lead to either growth or disruption of the bodies involved
and are largely responsible for shaping the final characteristics of the
planets. Despite their critical role in planet formation, an accurate treatment
of collisions has yet to be realized. While semi-analytic methods have been
proposed, they remain limited to a narrow set of post-impact properties and
have only achieved relatively low accuracies. However, the rise of machine
learning and access to increased computing power have enabled novel data-driven
approaches. In this work, we show that data-driven emulation techniques are
capable of predicting the outcome of collisions with high accuracy and are
generalizable to any quantifiable post-impact quantity. In particular, we focus
on the dataset requirements, training pipeline, and regression performance for
four distinct data-driven techniques from machine learning (ensemble methods
and neural networks) and uncertainty quantification (Gaussian processes and
polynomial chaos expansion). We compare these methods to existing analytic and
semi-analytic methods. Such data-driven emulators are poised to replace the
methods currently used in N-body simulations. This work is based on a new set
of 10,700 SPH simulations of pairwise collisions between rotating,
differentiated bodies at all possible mutual orientations.",astro-ph.EP,"astro-ph.IM, physics.comp-ph, astro-ph.EP",3,Earth and Planetary Astrophysics,"Instrumentation and Methods for Astrophysics, Computational Physics, Earth and Planetary Astrophysics",Stefano Marelli,"Miles Timpe, Maria Han Veiga, Mischa Knabenhans, Joachim Stadel, Stefano Marelli",5,http://arxiv.org/pdf/2001.09542v1,http://arxiv.org/abs/2001.09542v1,2020-01-27
"Discrimination universally determines reconstruction of multiplex
  networks","Network reconstruction is fundamental to understanding the dynamical
behaviors of the networked systems. Many systems, modeled by multiplex networks
with various types of interactions, display an entirely different dynamical
behavior compared to the corresponding aggregated network. In many cases,
unfortunately, only the aggregated topology and partial observations of the
network layers are available, raising an urgent demand for reconstructing
multiplex networks. We fill this gap by developing a mathematical and
computational tool based on the Expectation-Maximization framework to
reconstruct multiplex layer structures. The reconstruction accuracy depends on
the various factors, such as partial observation and network characteristics,
limiting our ability to predict and allocate observations. Surprisingly, by
using a mean-field approximation, we discovered that a discrimination indicator
that integrates all these factors universally determines the accuracy of
reconstruction. This discovery enables us to design the optimal strategies to
allocate the fixed budget for deriving the partial observations, promoting the
optimal reconstruction of multiplex networks. To further evaluate the
performance of our method, we predict beside structure also dynamical behaviors
on the multiplex networks, including percolation, random walk, and spreading
processes. Finally, applying our method on empirical multiplex networks drawn
from biological, transportation, and social domains, corroborate the
theoretical analysis.",physics.soc-ph,"physics.soc-ph, physics.data-an",2,Physics and Society,"Physics and Society, Data Analysis, Statistics and Probability",Jianxi Gao,"Mincheng Wu, Jiming Chen, Shibo He, Youxian Sun, Shlomo Havlin, Jianxi Gao",6,http://arxiv.org/pdf/2001.09809v1,http://arxiv.org/abs/2001.09809v1,2020-01-27
"Fast Algorithm for computing a matrix transform used to detect trends in
  noisy data","A recently discovered universal rank-based matrix method to extract trends
from noisy time series is described in [1] but the formula for the output
matrix elements, implemented there as an open-access supplement MATLAB computer
code, is ${\cal O}(N^4)$, with $N$ the matrix dimension. This can become
prohibitively large for time series with hundreds of sample points or more.
Based on recurrence relations, here we derive a much faster ${\cal O}(N^2)$
algorithm and provide code implementations in MATLAB and in open-source JULIA.
In some cases one has the output matrix and needs to solve an inverse problem
to obtain the input matrix. A fast algorithm and code for this companion
problem, also based on the above recurrence relations, are given. Finally, in
the narrower, but common, domains of (i) trend detection and (ii) parameter
estimation of a linear trend, users require, not the individual matrix
elements, but simply their accumulated mean value. For this latter case we
provide a yet faster ${\cal O}(N)$ heuristic approximation that relies on a
series of rank one matrices. These algorithms are illustrated on a time series
of high energy cosmic rays with $N > 4 \times 10^4$. [1] Universal Rank-Order
Transform to Extract Signals from Noisy Data, Glenn Ierley and Alex Kostinski,
Phys. Rev. X 9 031039 (2019).",physics.data-an,physics.data-an,1,"Data Analysis, Statistics and Probability","Data Analysis, Statistics and Probability",A. B. Kostinski,"D. J. Kestner, G. R. Ierley, A. B. Kostinski",3,http://arxiv.org/pdf/2001.09607v1,http://arxiv.org/abs/2001.09607v1,2020-01-27
