title,summary,primary_tag,tags,n_tags,primary_category,categories,author,authors,n_authors,url_pdf,url_href,date
Behavior Associations in Lone-Actor Terrorists,"Terrorist attacks carried out by individuals or single cells have
significantly accelerated over the last 20 years. This type of terrorism,
defined as lone-actor (LA) terrorism, stands as one of the greatest security
threats of our time. Research on LA behavior and characteristics has emerged
and accelerated over the last decade. While these studies have produced
valuable information on demographics, behavior, classifications, and warning
signs, the relationship among these characters are yet to be addressed.
Moreover, the means of radicalization and attacking have changed over decades.
This study first identifies 25 binary behavioral characteristics of LAs and
analyzes 192 LAs recorded on three different databases. Next, the
classification is carried out according to first ideology, then to incident
scene behavior via a virtual attacker-defender game, and, finally, according to
the clusters obtained from the data. In addition, within each class,
statistically significant associations and temporal relations are extracted
using the A-priori algorithm. These associations would be instrumental in
identifying the attacker type and intervene at the right time. The results
indicate that while pre-9/11 LAs were mostly radicalized by the people in their
environment, post-9/11 LAs are more diverse. Furthermore, the association
chains for different LA types present unique characteristic pathways to
violence and after-attack behavior.",stat.AP,stat.AP,1,Applications,Applications,Pernille Hemmer,"Ayca Altay, Melike Baykal-Gürsoy, Pernille Hemmer",3,http://arxiv.org/pdf/2001.09945v1,http://arxiv.org/abs/2001.09945v1,2020-01-27
"Data-Driven Prediction Model of Components Shift during Reflow Process
  in Surface Mount Technology","In surface mount technology (SMT), mounted components on soldered pads are
subject to move during reflow process. This capability is known as
self-alignment and is the result of fluid dynamic behaviour of molten solder
paste. This capability is critical in SMT because inaccurate self-alignment
causes defects such as overhanging, tombstoning, etc. while on the other side,
it can enable components to be perfectly self-assembled on or near the desire
position. The aim of this study is to develop a machine learning model that
predicts the components movement during reflow in x and y-directions as well as
rotation. Our study is composed of two steps: (1) experimental data are studied
to reveal the relationships between self-alignment and various factors
including component geometry, pad geometry, etc. (2) advanced machine learning
prediction models are applied to predict the distance and the direction of
components shift using support vector regression (SVR), neural network (NN),
and random forest regression (RFR). As a result, RFR can predict components
shift with the average fitness of 99%, 99%, and 96% and with average prediction
error of 13.47 (um), 12.02 (um), and 1.52 (deg.) for component shift in x, y,
and rotational directions, respectively. This enhancement provides the future
capability of the parameters' optimization in the pick and placement machine to
control the best placement location and minimize the intrinsic defects caused
by the self-alignment.",eess.SY,"stat.ML, cs.LG, cs.SY, eess.SY, stat.AP",5,eess.SY,"Machine Learning, Machine Learning, Systems and Control, Applications",Daehan Won,"Irandokht Parviziomran, Shun Cao, Krishnaswami Srihari, Daehan Won",4,http://arxiv.org/pdf/2001.09619v1,http://arxiv.org/abs/2001.09619v1,2020-01-27
"Shapley value confidence intervals for variable selection in regression
  models","Multiple linear regression is a commonly used inferential and predictive
process, whereby a single response variable is modeled via an affine
combination of multiple explanatory covariates. The coefficient of
determination is often used to measure the explanatory power of the chosen
combination of covariates. A ranking of the explanatory contribution of each of
the individual covariates is often sought in order to draw inference regarding
the importance of each covariate with respect to the response phenomenon. A
recent method for ascertaining such a ranking is via the game theoretic Shapley
value decomposition of the coefficient of determination. Such a decomposition
has the desirable efficiency, monotonicity, and equal treatment properties.
Under an elliptical assumption, we obtain the asymptotic normality of the
Shapley values. We then utilize this result in order to construct confidence
intervals and hypothesis tests regarding such quantities. Monte Carlo studies
regarding our results are provided. We found that our asymptotic confidence
intervals are computationally superior to competing bootstrap methods and are
able to improve upon the performance of such intervals. Analyses of housing and
real estate data are used to demonstrate the applicability of our methodology.",stat.ME,"stat.ME, stat.CO",2,Methodology,"Methodology, Computation",Hien Nguyen,"Daniel Fryer, Inga Strumke, Hien Nguyen",3,http://arxiv.org/pdf/2001.09593v1,http://arxiv.org/abs/2001.09593v1,2020-01-27
Penalized angular regression for personalized predictions,"Personalization is becoming an important feature in many predictive
applications. We introduce a penalized regression method implementing
personalization inherently in the penalty. Personalized angle (PAN) regression
constructs regression coefficients that are specific to the covariate vector
for which one is producing a prediction, thus personalizing the regression
model itself. This is achieved by penalizing the angles in a hyperspherical
parametrization of the regression coefficients. For an orthogonal design
matrix, it is shown that the PAN estimate is the solution to a low-dimensional
eigenvector equation. Using a parametric bootstrap procedure to select the
tuning parameter, simulations show that PAN regression can outperform ordinary
least squares and ridge regression in terms of prediction error. We further
prove that by combining the PAN penalty with an $L_{2}$ penalty the resulting
method will have uniformly smaller mean squared prediction error than ridge
regression, asymptotically. Finally, we demonstrate the method in a medical
application.",stat.ME,stat.ME,1,Methodology,Methodology,Kristoffer H. Hellton,Kristoffer H. Hellton,1,http://arxiv.org/pdf/2001.09834v1,http://arxiv.org/abs/2001.09834v1,2020-01-27
