title,summary,primary_tag,tags,n_tags,primary_category,categories,author,authors,n_authors,url_pdf,url_href,date
"SAUNet: Shape Attentive U-Net for Interpretable Medical Image
  Segmentation","Medical image segmentation is a difficult but important task for many
clinical operations such as cardiac bi-ventricular volume estimation. More
recently, there has been a shift to utilizing deep learning and fully
convolutional neural networks (CNNs) to perform image segmentation that has
yielded state-of-the-art results in many public benchmark datasets. Despite the
progress of deep learning in medical image segmentation, standard CNNs are
still not fully adopted in clinical settings as they lack robustness and
interpretability. Shapes are generally more meaningful features than solely
textures of images, which are features regular CNNs learn, causing a lack of
robustness. Likewise, previous works surrounding model interpretability have
been focused on post hoc gradient-based saliency methods. However,
gradient-based saliency methods typically require additional computations post
hoc and have been shown to be unreliable for interpretability. Thus, we present
a new architecture called Shape Attentive U-Net (SAUNet) which focuses on model
interpretability and robustness. The proposed architecture attempts to address
these limitations by the use of a secondary shape stream that captures rich
shape-dependent information in parallel with the regular texture stream.
Furthermore, we suggest multi-resolution saliency maps can be learned using our
dual-attention decoder module which allows for multi-level interpretability and
mitigates the need for additional computations post hoc. Our method also
achieves state-of-the-art results on the two large public cardiac MRI image
segmentation datasets of SUN09 and AC17.",eess.IV,"eess.IV, cs.CV",2,Image and Video Processing,"Image and Video Processing, Computer Vision and Pattern Recognition",Bo Wang,"Jesse Sun, Fatemeh Darbeha, Mark Zaidi, Bo Wang",4,http://arxiv.org/pdf/2001.07645v1,http://arxiv.org/abs/2001.07645v1,2020-01-21
"Generate High-Resolution Adversarial Samples by Identifying Effective
  Features","As the prevalence of deep learning in computer vision, adversarial samples
that weaken the neural networks emerge in large numbers, revealing their
deep-rooted defects. Most adversarial attacks calculate an imperceptible
perturbation in image space to fool the DNNs. In this strategy, the
perturbation looks like noise and thus could be mitigated. Attacks in feature
space produce semantic perturbation, but they could only deal with low
resolution samples. The reason lies in the great number of coupled features to
express a high-resolution image. In this paper, we propose Attack by
Identifying Effective Features (AIEF), which learns different weights for
features to attack. Effective features, those with great weights, influence the
victim model much but distort the image little, and thus are more effective for
attack. By attacking mostly on them, AIEF produces high resolution adversarial
samples with acceptable distortions. We demonstrate the effectiveness of AIEF
by attacking on different tasks with different generative models.",cs.LG,"stat.ML, cs.CV, cs.LG",3,Machine Learning,"Machine Learning, Computer Vision and Pattern Recognition, Machine Learning",Xiaolin Huang,"Sizhe Chen, Peidong Zhang, Chengjin Sun, Jia Cai, Xiaolin Huang",5,http://arxiv.org/pdf/2001.07631v1,http://arxiv.org/abs/2001.07631v1,2020-01-21
"batchboost: regularization for stabilizing training with resistance to
  underfitting & overfitting","Overfitting & underfitting and stable training are an important challenges in
machine learning. Current approaches for these issues are mixup, SamplePairing
and BC learning. In our work, we state the hypothesis that mixing many images
together can be more effective than just two. Batchboost pipeline has three
stages: (a) pairing: method of selecting two samples. (b) mixing: how to create
a new one from two samples. (c) feeding: combining mixed samples with new ones
from dataset into batch (with ratio $\gamma$). Note that sample that appears in
our batch propagates with subsequent iterations with less and less importance
until the end of training. Pairing stage calculates the error per sample, sorts
the samples and pairs with strategy: hardest with easiest one, than mixing
stage merges two samples using mixup, $x_1 + (1-\lambda)x_2$. Finally, feeding
stage combines new samples with mixed by ratio 1:1. Batchboost has 0.5-3%
better accuracy than the current state-of-the-art mixup regularization on
CIFAR-10 & Fashion-MNIST. Our method is slightly better than SamplePairing
technique on small datasets (up to 5%). Batchboost provides stable training on
not tuned parameters (like weight decay), thus its a good method to test
performance of different architectures. Source code is at:
https://github.com/maciejczyzewski/batchboost",cs.LG,"stat.ML, cs.CV, cs.LG",3,Machine Learning,"Machine Learning, Computer Vision and Pattern Recognition, Machine Learning",Maciej A. Czyzewski,Maciej A. Czyzewski,1,http://arxiv.org/pdf/2001.07627v1,http://arxiv.org/abs/2001.07627v1,2020-01-21
PatchPerPix for Instance Segmentation,"In this paper we present a novel method for proposal free instance
segmentation that can handle sophisticated object shapes that span large parts
of an image and form dense object clusters with crossovers. Our method is based
on predicting dense local shape descriptors, which we assemble to form
instances. All instances are assembled simultaneously in one go. To our
knowledge, our method is the first non-iterative method that guarantees
instances to be composed of learnt shape patches. We evaluate our method on a
variety of data domains, where it defines the new state of the art on two
challenging benchmarks, namely the ISBI 2012 EM segmentation benchmark, and the
BBBC010 C. elegans dataset. We show furthermore that our method performs well
also on 3d image data, and can handle even extreme cases of complex shape
clusters.",cs.CV,cs.CV,1,Computer Vision and Pattern Recognition,Computer Vision and Pattern Recognition,Dagmar Kainmueller,"Peter Hirsch, Lisa Mais, Dagmar Kainmueller",3,http://arxiv.org/pdf/2001.07626v1,http://arxiv.org/abs/2001.07626v1,2020-01-21
"Motif Difference Field: A Simple and Effective Image Representation of
  Time Series for Classification","Time series motifs play an important role in the time series analysis. The
motif-based time series clustering is used for the discovery of higher-order
patterns or structures in time series data. Inspired by the convolutional
neural network (CNN) classifier based on the image representations of time
series, motif difference field (MDF) is proposed. Compared to other image
representations of time series, MDF is simple and easy to construct. With the
Fully Convolution Network (FCN) as the classifier, MDF demonstrates the
superior performance on the UCR time series dataset in benchmark with other
time series classification methods. It is interesting to find that the triadic
time series motifs give the best result in the test. Due to the motif
clustering reflected in MDF, the significant motifs are detected with the help
of the Gradient-weighted Class Activation Mapping (Grad-CAM). The areas in MDF
with high weight in Grad-CAM have a high contribution from the significant
motifs with the desired ordinal patterns associated with the signature patterns
in time series. However, the signature patterns cannot be identified with the
neural network classifiers directly based on the time series.",cs.LG,"stat.ML, cs.CV, cs.LG",3,Machine Learning,"Machine Learning, Computer Vision and Pattern Recognition, Machine Learning",Xin Chen,"Yadong Zhang, Xin Chen",2,http://arxiv.org/pdf/2001.07582v1,http://arxiv.org/abs/2001.07582v1,2020-01-21
Geometric Proxies for Live RGB-D Stream Enhancement and Consolidation,"We propose a geometric superstructure for unified real-time processing of
RGB-D data. Modern RGB-D sensors are widely used for indoor 3D capture, with
applications ranging from modeling to robotics, through augmented reality.
Nevertheless, their use is limited by their low resolution, with frames often
corrupted with noise, missing data and temporal inconsistencies. Our approach
consists in generating and updating through time a single set of compact local
statistics parameterized over detected geometric proxies, which are fed from
raw RGB-D data. Our proxies provide several processing primitives, which
improve the quality of the RGB-D stream on the fly or lighten further
operations. Experimental results confirm that our lightweight analysis
framework copes well with embedded execution as well as moderate memory and
computational capabilities compared to state-of-the-art methods. Processing
RGB-D data with our proxies allows noise and temporal flickering removal, hole
filling and resampling. As a substitute of the observed scene, our proxies can
additionally be applied to compression and scene reconstruction. We present
experiments performed with our framework in indoor scenes of different natures
within a recent open RGB-D dataset.",cs.CV,cs.CV,1,Computer Vision and Pattern Recognition,Computer Vision and Pattern Recognition,Tamy Boubekeur,"Adrien Kaiser, José Alonso Ybanez Zepeda, Tamy Boubekeur",3,http://arxiv.org/pdf/2001.07577v1,http://arxiv.org/abs/2001.07577v1,2020-01-21
Multimodal Deep Unfolding for Guided Image Super-Resolution,"The reconstruction of a high resolution image given a low resolution
observation is an ill-posed inverse problem in imaging. Deep learning methods
rely on training data to learn an end-to-end mapping from a low-resolution
input to a high-resolution output. Unlike existing deep multimodal models that
do not incorporate domain knowledge about the problem, we propose a multimodal
deep learning design that incorporates sparse priors and allows the effective
integration of information from another image modality into the network
architecture. Our solution relies on a novel deep unfolding operator,
performing steps similar to an iterative algorithm for convolutional sparse
coding with side information; therefore, the proposed neural network is
interpretable by design. The deep unfolding architecture is used as a core
component of a multimodal framework for guided image super-resolution. An
alternative multimodal design is investigated by employing residual learning to
improve the training efficiency. The presented multimodal approach is applied
to super-resolution of near-infrared and multi-spectral images as well as depth
upsampling using RGB images as side information. Experimental results show that
our model outperforms state-of-the-art methods.",eess.IV,"eess.IV, cs.CV, cs.LG",3,Image and Video Processing,"Image and Video Processing, Computer Vision and Pattern Recognition, Machine Learning",Nikos Deligiannis,"Iman Marivani, Evaggelia Tsiligianni, Bruno Cornelis, Nikos Deligiannis",4,http://arxiv.org/pdf/2001.07575v1,http://arxiv.org/abs/2001.07575v1,2020-01-21
"Joint Learning of Instance and Semantic Segmentation for Robotic
  Pick-and-Place with Heavy Occlusions in Clutter","We present joint learning of instance and semantic segmentation for visible
and occluded region masks. Sharing the feature extractor with instance
occlusion segmentation, we introduce semantic occlusion segmentation into the
instance segmentation model. This joint learning fuses the instance- and
image-level reasoning of the mask prediction on the different segmentation
tasks, which was missing in the previous work of learning instance segmentation
only (instance-only). In the experiments, we evaluated the proposed joint
learning comparing the instance-only learning on the test dataset. We also
applied the joint learning model to 2 different types of robotic pick-and-place
tasks (random and target picking) and evaluated its effectiveness to achieve
real-world robotic tasks.",cs.RO,"cs.RO, cs.CV",2,Robotics,"Robotics, Computer Vision and Pattern Recognition",Masayuki Inaba,"Kentaro Wada, Kei Okada, Masayuki Inaba",3,http://arxiv.org/pdf/2001.07481v1,http://arxiv.org/abs/2001.07481v1,2020-01-21
P$^2$-GAN: Efficient Style Transfer Using Single Style Image,"Style transfer is a useful image synthesis technique that can re-render given
image into another artistic style while preserving its content information.
Generative Adversarial Network (GAN) is a widely adopted framework toward this
task for its better representation ability on local style patterns than the
traditional Gram-matrix based methods. However, most previous methods rely on
sufficient amount of pre-collected style images to train the model. In this
paper, a novel Patch Permutation GAN (P$^2$-GAN) network that can efficiently
learn the stroke style from a single style image is proposed. We use patch
permutation to generate multiple training samples from the given style image. A
patch discriminator that can simultaneously process patch-wise images and
natural images seamlessly is designed. We also propose a local texture
descriptor based criterion to quantitatively evaluate the style transfer
quality. Experimental results showed that our method can produce finer quality
re-renderings from single style image with improved computational efficiency
compared with many state-of-the-arts methods.",cs.CV,"eess.IV, cs.CV",2,Computer Vision and Pattern Recognition,"Image and Video Processing, Computer Vision and Pattern Recognition",Jianyi Liu,"Zhentan Zheng, Jianyi Liu",2,http://arxiv.org/pdf/2001.07466v1,http://arxiv.org/abs/2001.07466v1,2020-01-21
Detecting Face2Face Facial Reenactment in Videos,"Visual content has become the primary source of information, as evident in
the billions of images and videos, shared and uploaded on the Internet every
single day. This has led to an increase in alterations in images and videos to
make them more informative and eye-catching for the viewers worldwide. Some of
these alterations are simple, like copy-move, and are easily detectable, while
other sophisticated alterations like reenactment based DeepFakes are hard to
detect. Reenactment alterations allow the source to change the target
expressions and create photo-realistic images and videos. While technology can
be potentially used for several applications, the malicious usage of automatic
reenactment has a very large social implication. It is therefore important to
develop detection techniques to distinguish real images and videos with the
altered ones. This research proposes a learning-based algorithm for detecting
reenactment based alterations. The proposed algorithm uses a multi-stream
network that learns regional artifacts and provides a robust performance at
various compression levels. We also propose a loss function for the balanced
learning of the streams for the proposed network. The performance is evaluated
on the publicly available FaceForensics dataset. The results show
state-of-the-art classification accuracy of 99.96%, 99.10%, and 91.20% for no,
easy, and hard compression factors, respectively.",cs.CV,cs.CV,1,Computer Vision and Pattern Recognition,Computer Vision and Pattern Recognition,Richa Singh,"Prabhat Kumar, Mayank Vatsa, Richa Singh",3,http://arxiv.org/pdf/2001.07444v1,http://arxiv.org/abs/2001.07444v1,2020-01-21
Evaluating Weakly Supervised Object Localization Methods Right,"Weakly-supervised object localization (WSOL) has gained popularity over the
last years for its promise to train localization models with only image-level
labels. Since the seminal WSOL work of class activation mapping (CAM), the
field has focused on how to expand the attention regions to cover objects more
broadly and localize them better. However, these strategies rely on full
localization supervision to validate hyperparameters and for model selection,
which is in principle prohibited under the WSOL setup. In this paper, we argue
that WSOL task is ill-posed with only image-level labels, and propose a new
evaluation protocol where full supervision is limited to only a small held-out
set not overlapping with the test set. We observe that, under our protocol, the
five most recent WSOL methods have not made a major improvement over the CAM
baseline. Moreover, we report that existing WSOL methods have not reached the
few-shot learning baseline, where the full-supervision at validation time is
used for model training instead. Based on our findings, we discuss some future
directions for WSOL.",cs.CV,"cs.CV, cs.LG",2,Computer Vision and Pattern Recognition,"Computer Vision and Pattern Recognition, Machine Learning",Hyunjung Shim,"Junsuk Choe, Seong Joon Oh, Seungho Lee, Sanghyuk Chun, Zeynep Akata, Hyunjung Shim",6,http://arxiv.org/pdf/2001.07437v1,http://arxiv.org/abs/2001.07437v1,2020-01-21
Mobility Inference on Long-Tailed Sparse Trajectory,"Analyzing the urban trajectory in cities has become an important topic in
data mining. How can we model the human mobility consisting of stay and travel
from the raw trajectory data? How can we infer such a mobility model from the
single trajectory information? How can we further generalize the mobility
inference to accommodate the real-world trajectory data that is sparsely
sampled over time?
  In this paper, based on formal and rigid definitions of the stay/travel
mobility, we propose a single trajectory inference algorithm that utilizes a
generic long-tailed sparsity pattern in the large-scale trajectory data. The
algorithm guarantees a 100\% precision in the stay/travel inference with a
provable lower-bound in the recall. Furthermore, we introduce an
encoder-decoder learning architecture that admits multiple trajectories as
inputs. The architecture is optimized for the mobility inference problem
through customized embedding and learning mechanism. Evaluations with three
trajectory data sets of 40 million urban users validate the performance
guarantees of the proposed inference algorithm and demonstrate the superiority
of our deep learning model, in comparison to well-known sequence learning
methods. On extremely sparse trajectories, the deep learning model achieves a
2$\times$ overall accuracy improvement from the single trajectory inference
algorithm, through proven scalability and generalizability to large-scale
versatile training data.",cs.LG,"cs.SI, stat.ML, cs.LG",3,Machine Learning,"Social and Information Networks, Machine Learning, Machine Learning",Lei Shi,Lei Shi,1,http://arxiv.org/pdf/2001.07636v1,http://arxiv.org/abs/2001.07636v1,2020-01-21
EdgeNets:Edge Varying Graph Neural Networks,"Driven by the outstanding performance of neural networks in the structured
Euclidean domain, recent years have seen a surge of interest in developing
neural networks for graphs and data supported on graphs. The graph is leveraged
as a parameterization to capture detail at the node level with a reduced number
of parameters and complexity. Following this rationale, this paper puts forth a
general framework that unifies state-of-the-art graph neural networks (GNNs)
through the concept of EdgeNet. An EdgeNet is a GNN architecture that allows
different nodes to use different parameters to weigh the information of
different neighbors. By extrapolating this strategy to more iterations between
neighboring nodes, the EdgeNet learns edge- and neighbor-dependent weights to
capture local detail. This is the most general local operation that a node can
do and encompasses under one formulation all graph convolutional neural
networks (GCNNs) as well as graph attention networks (GATs). In writing
different GNN architectures with a common language, EdgeNets highlight specific
architecture advantages and limitations, while providing guidelines to improve
their capacity without compromising their local implementation. For instance,
we show that GCNNs have a parameter sharing structure that induces permutation
equivariance. This can be an advantage or a limitation, depending on the
application. When it is a limitation, we propose hybrid approaches and provide
insights to develop several other solutions that promote parameter sharing
without enforcing permutation equivariance. Another interesting conclusion is
the unification of GCNNs and GATs -approaches that have been so far perceived
as separate. In particular, we show that GATs are GCNNs on a graph that is
learned from the features. This particularization opens the doors to develop
alternative attention mechanisms for improving discriminatory power.",cs.LG,"stat.ML, eess.SP, cs.NE, cs.LG",4,Machine Learning,"Machine Learning, Signal Processing, Neural and Evolutionary Computing, Machine Learning",Alejandro Ribeiro,"Elvin Isufi, Fernando Gama, Alejandro Ribeiro",3,http://arxiv.org/pdf/2001.07620v1,http://arxiv.org/abs/2001.07620v1,2020-01-21
TopRank+: A Refinement of TopRank Algorithm,"Online learning to rank is a core problem in machine learning. In Lattimore
et al. (2018), a novel online learning algorithm was proposed based on
topological sorting. In the paper they provided a set of self-normalized
inequalities (a) in the algorithm as a criterion in iterations and (b) to
provide an upper bound for cumulative regret, which is a measure of algorithm
performance. In this work, we utilized method of mixtures and asymptotic
expansions of certain implicit function to provide a tighter, iterated-log-like
boundary for the inequalities, and as a consequence improve both the algorithm
itself as well as its performance estimation.",stat.ML,"stat.ML, cs.LG, 60-04",3,Machine Learning,"Machine Learning, Machine Learning",Haolin Zou,"Victor de la Pena, Haolin Zou",2,http://arxiv.org/pdf/2001.07617v1,http://arxiv.org/abs/2001.07617v1,2020-01-21
Simple and Effective Graph Autoencoders with One-Hop Linear Models,"Graph autoencoders (AE) and variational autoencoders (VAE) recently emerged
as powerful node embedding methods, with promising performances on challenging
tasks such as link prediction and node clustering. Graph AE, VAE and most of
their extensions rely on graph convolutional networks (GCN) encoders to learn
vector space representations of nodes. In this paper, we propose to replace the
GCN encoder by a significantly simpler linear model w.r.t. the direct
neighborhood (one-hop) adjacency matrix of the graph. For the two
aforementioned tasks, we show that this approach consistently reaches
competitive performances w.r.t. GCN-based models for numerous real-world
graphs, including all benchmark datasets commonly used to evaluate graph AE and
VAE. We question the relevance of repeatedly using these datasets to compare
complex graph AE and VAE. We also emphasize the effectiveness of the proposed
encoding scheme, that appears as a simpler and faster alternative to GCN
encoders for many real-world applications.",cs.LG,"cs.SI, stat.ML, cs.LG",3,Machine Learning,"Social and Information Networks, Machine Learning, Machine Learning",Michalis Vazirgiannis,"Guillaume Salha, Romain Hennequin, Michalis Vazirgiannis",3,http://arxiv.org/pdf/2001.07614v1,http://arxiv.org/abs/2001.07614v1,2020-01-21
"R2DE: a NLP approach to estimating IRT parameters of newly generated
  questions","The main objective of exams consists in performing an assessment of students'
expertise on a specific subject. Such expertise, also referred to as skill or
knowledge level, can then be leveraged in different ways (e.g., to assign a
grade to the students, to understand whether a student might need some support,
etc.). Similarly, the questions appearing in the exams have to be assessed in
some way before being used to evaluate students. Standard approaches to
questions' assessment are either subjective (e.g., assessment by human experts)
or introduce a long delay in the process of question generation (e.g.,
pretesting with real students). In this work we introduce R2DE (which is a
Regressor for Difficulty and Discrimination Estimation), a model capable of
assessing newly generated multiple-choice questions by looking at the text of
the question and the text of the possible choices. In particular, it can
estimate the difficulty and the discrimination of each question, as they are
defined in Item Response Theory. We also present the results of extensive
experiments we carried out on a real world large scale dataset coming from an
e-learning platform, showing that our model can be used to perform an initial
assessment of newly created questions and ease some of the problems that arise
in question generation.",cs.LG,"stat.ML, cs.CL, cs.LG",3,Machine Learning,"Machine Learning, Computation and Language, Machine Learning",Paolo Cremonesi,"Luca Benedetto, Andrea Cappelli, Roberto Turrin, Paolo Cremonesi",4,http://arxiv.org/pdf/2001.07569v1,http://arxiv.org/abs/2001.07569v1,2020-01-21
