title,summary,primary_tag,tags,n_tags,primary_category,categories,author,authors,n_authors,url_pdf,url_href,date
"Bayesian Spatial Models for Voxel-wise Prostate Cancer Classification
  Using Multi-parametric MRI Data","Multi-parametric magnetic resonance imaging (mpMRI) plays an increasingly
important role in the diagnosis of prostate cancer. Various computer-aided
detection algorithms have been proposed for automated prostate cancer detection
by combining information from various mpMRI data components. However, there
exist other features of mpMRI, including the spatial correlation between voxels
and between-patient heterogeneity in the mpMRI parameters, that have not been
fully explored in the literature but could potentially improve cancer detection
if leveraged appropriately. This paper proposes novel voxel-wise Bayesian
classifiers for prostate cancer that account for the spatial correlation and
between-patient heterogeneity in mpMRI. Modeling the spatial correlation is
challenging due to the extreme high dimensionality of the data, and we consider
three computationally efficient approaches using Nearest Neighbor Gaussian
Process (NNGP), knot-based reduced-rank approximation, and a conditional
autoregressive (CAR) model, respectively. The between-patient heterogeneity is
accounted for by adding a subject-specific random intercept on the mpMRI
parameter model. Simulation results show that properly modeling the spatial
correlation and between-patient heterogeneity improves classification accuracy.
Application to in vivo data illustrates that classification is improved by
spatial modeling using NNGP and reduced-rank approximation but not the CAR
model, while modeling the between-patient heterogeneity does not further
improve our classifier. Among our proposed models, the NNGP-based model is
recommended considering its robust classification accuracy and high
computational efficiency.",stat.AP,stat.AP,1,Applications,Applications,Joseph S. Koopmeiners,"Jin Jin, Lin Zhang, Ethan Leng, Gregory J. Metzger, Joseph S. Koopmeiners",5,http://arxiv.org/pdf/2001.07316v1,http://arxiv.org/abs/2001.07316v1,2020-01-21
"MonteCarloMeasurements.jl: Nonlinear Propagation of Arbitrary
  Multivariate Distributions by means of Method Overloading","This manuscript outlines a software package that facilitates working with
probability distributions by means of Monte-Carlo methods, in a way that allows
for propagation of multivariate probability distributions through arbitrary
functions. We provide a \emph{type} that represents probability distributions
by an internal vector of unweighted samples, \texttt{Particles}, which is a
subtype of a \texttt{Real} number and behaves just like a regular real number
in calculations by means of method overloading. This makes the software easy to
work with and presents minimal friction for the user. We highlight how this
design facilitates optimal usage of SIMD instructions and showcase the package
for uncertainty propagation through an off-the-shelf ODE solver, as well as for
robust probabilistic optimization with automatic differentiation.",cs.MS,"stat.OT, cs.MS, stat.CO",3,Mathematical Software,"Other Statistics, Mathematical Software, Computation",Fredrik Bagge Carlson,Fredrik Bagge Carlson,1,http://arxiv.org/pdf/2001.07625v1,http://arxiv.org/abs/2001.07625v1,2020-01-21
"Clinical Prediction Models to Predict the Risk of Multiple Binary
  Outcomes: a comparison of approaches","Clinical prediction models (CPMs) are used to predict clinically relevant
outcomes or events. Typically, prognostic CPMs are derived to predict the risk
of a single future outcome. However, with rising emphasis on the prediction of
multi-morbidity, there is growing need for CPMs to simultaneously predict risks
for each of multiple future outcomes. A common approach to multi-outcome risk
prediction is to derive a CPM for each outcome separately, then multiply the
predicted risks. This approach is only valid if the outcomes are conditionally
independent given the covariates, and it fails to exploit the potential
relationships between the outcomes. This paper outlines several approaches that
could be used to develop prognostic CPMs for multiple outcomes. We consider
four methods, ranging in complexity and assumed conditional independence
assumptions: namely, probabilistic classifier chain, multinomial logistic
regression, multivariate logistic regression, and a Bayesian probit model.
These are compared with methods that rely on conditional independence: separate
univariate CPMs and stacked regression. Employing a simulation study and
real-world example via the MIMIC-III database, we illustrate that CPMs for
joint risk prediction of multiple outcomes should only be derived using methods
that model the residual correlation between outcomes. In such a situation, our
results suggest that probabilistic classification chains, multinomial logistic
regression or the Bayesian probit model are all appropriate choices. We call
into question the development of CPMs for each outcome in isolation when
multiple correlated or structurally related outcomes are of interest and
recommend more holistic risk prediction.",stat.ME,stat.ME,1,Methodology,Methodology,Richard D. Riley,"Glen P. Martin, Matthew Sperrin, Kym I. E. Snell, Iain Buchan, Richard D. Riley",5,http://arxiv.org/pdf/2001.07624v1,http://arxiv.org/abs/2001.07624v1,2020-01-21
"Understanding the stochastic partial differential equation approach to
  smoothing","Correlation and smoothness are terms used to describe a wide variety of
random quantities. In time, space, and many other domains, they both imply the
same idea: quantities that occur closer together are more similar than those
further apart. Two popular statistical models that represent this idea are
basis-penalty smoothers (Wood, 2017) and stochastic partial differential
equations (SPDE) (Lindgren et al., 2011). In this paper, we discuss how the
SPDE can be interpreted as a smoothing penalty and can be fitted using the R
package mgcv, allowing practitioners with existing knowledge of smoothing
penalties to better understand the implementation and theory behind the SPDE
approach.",stat.ME,stat.ME,1,Methodology,Methodology,Andrew E Seaton,"David L Miller, Richard Glennie, Andrew E Seaton",3,http://arxiv.org/pdf/2001.07623v1,http://arxiv.org/abs/2001.07623v1,2020-01-21
Learning to Control PDEs with Differentiable Physics,"Predicting outcomes and planning interactions with the physical world are
long-standing goals for machine learning. A variety of such tasks involves
continuous physical systems, which can be described by partial differential
equations (PDEs) with many degrees of freedom. Existing methods that aim to
control the dynamics of such systems are typically limited to relatively short
time frames or a small number of interaction parameters. We present a novel
hierarchical predictor-corrector scheme which enables neural networks to learn
to understand and control complex nonlinear physical systems over long time
frames. We propose to split the problem into two distinct tasks: planning and
control. To this end, we introduce a predictor network that plans optimal
trajectories and a control network that infers the corresponding control
parameters. Both stages are trained end-to-end using a differentiable PDE
solver. We demonstrate that our method successfully develops an understanding
of complex physical systems and learns to control them for tasks involving PDEs
such as the incompressible Navier-Stokes equations.",cs.LG,"stat.ML, physics.flu-dyn, cs.LG",3,Machine Learning,"Machine Learning, Fluid Dynamics, Machine Learning",Nils Thuerey,"Philipp Holl, Vladlen Koltun, Nils Thuerey",3,http://arxiv.org/pdf/2001.07457v1,http://arxiv.org/abs/2001.07457v1,2020-01-21
Integrating data science ethics into an undergraduate major,"We present a programmatic approach to incorporating ethics into an
undergraduate major in statistical and data sciences. We discuss
departmental-level initiatives designed to meet the National Academy of
Sciences recommendation for weaving ethics into the curriculum from
top-to-bottom as our majors progress from our introductory courses to our
senior capstone course, as well as from side-to-side through co-curricular
programming. We also provide six examples of data science ethics modules
(""patches"") used in five different courses at our liberal arts college, each
focusing on a different ethical consideration. The patches are designed to be
portable such that they can be flexibly incorporated into existing courses at
different levels of instruction with minimal disruption to syllabi. We conclude
with next steps and preliminary assessments.",stat.OT,"stat.OT, K.7.4; K.3.2, 00A05, cs.OH",4,Other Statistics,"Other Statistics, Other Computer Science",Miles Q. Ott,"Benjamin S. Baumer, Randi L. Garcia, Albert Y. Kim, Katherine M. Kinnaird, Miles Q. Ott",5,http://arxiv.org/pdf/2001.07649v1,http://arxiv.org/abs/2001.07649v1,2020-01-21
"The Principled Prediction-Problem Ontology: when black box algorithms
  are (not) appropriate","Black-box algorithms have had astonishing success in some settings. But their
unpredictable brittleness has provoked serious concern and increased scrutiny.
For any given black-box algorithm understanding where it might fail is
extraordinarily challenging. In contrast, understanding which settings are not
appropriate for black-box deployment requires no more than understanding simply
how they are developed. We introduce a framework that isolates four
problem-features -- measurement, adaptability, resilience, and agnosis -- which
need to be carefully considered before selecting an algorithm. This paper lays
out a principled framework, justified through careful decomposition of the
system components used to develop black-box algorithms, for people to
understand and discuss where black-box algorithms are appropriate and, more
frequently, where they are not appropriate.",stat.OT,stat.OT,1,Other Statistics,Other Statistics,Michael Baiocchi,"Jordan Rodu, Michael Baiocchi",2,http://arxiv.org/pdf/2001.07648v1,http://arxiv.org/abs/2001.07648v1,2020-01-21
