title,summary,primary_tag,tags,n_tags,primary_category,categories,author,authors,n_authors,url_pdf,url_href,date
"Intelligent Bandwidth Allocation for Latency Management in NG-EPON using
  Reinforcement Learning Methods","A novel intelligent bandwidth allocation scheme in NG-EPON using
reinforcement learning is proposed and demonstrated for latency management. We
verify the capability of the proposed scheme under both fixed and dynamic
traffic loads scenarios to achieve <1ms average latency. The RL agent
demonstrates an efficient intelligent mechanism to manage the latency, which
provides a promising IBA solution for the next-generation access network.",cs.NI,"eess.SP, cs.LG, cs.NI",3,Networking and Internet Architecture,"Signal Processing, Machine Learning, Networking and Internet Architecture",Gee-Kung Chang,"Qi Zhou, Jingjie Zhu, Junwen Zhang, Zhensheng Jia, Bernardo Huberman, Gee-Kung Chang",6,http://arxiv.org/pdf/2001.07698v1,http://arxiv.org/abs/2001.07698v1,2020-01-21
Stochastic Finite State Control of POMDPs with LTL Specifications,"Partially observable Markov decision processes (POMDPs) provide a modeling
framework for autonomous decision making under uncertainty and imperfect
sensing, e.g. robot manipulation and self-driving cars. However, optimal
control of POMDPs is notoriously intractable. This paper considers the
quantitative problem of synthesizing sub-optimal stochastic finite state
controllers (sFSCs) for POMDPs such that the probability of satisfying a set of
high-level specifications in terms of linear temporal logic (LTL) formulae is
maximized. We begin by casting the latter problem into an optimization and use
relaxations based on the Poisson equation and McCormick envelopes. Then, we
propose an stochastic bounded policy iteration algorithm, leading to a
controlled growth in sFSC size and an any time algorithm, where the performance
of the controller improves with successive iterations, but can be stopped by
the user based on time or memory considerations. We illustrate the proposed
method by a robot navigation case study.",cs.AI,"cs.RO, eess.SY, cs.FL, cs.SY, math.OC, cs.AI",6,Artificial Intelligence,"Robotics, Formal Languages and Automata Theory, Systems and Control, Optimization and Control, Artificial Intelligence",Joel W. Burdick,"Mohamadreza Ahmadi, Rangoli Sharan, Joel W. Burdick",3,http://arxiv.org/pdf/2001.07679v1,http://arxiv.org/abs/2001.07679v1,2020-01-21
Deceptive AI Explanations: Creation and Detection,"Artificial intelligence comes with great opportunities and but also great
risks. We investigate to what extent deep learning can be used to create and
detect deceptive explanations that either aim to lure a human into believing a
decision that is not truthful to the model or provide reasoning that is
non-faithful to the decision. Our theoretical insights show some limits of
deception and detection in the absence of domain knowledge. For empirical
evaluation, we focus on text classification. To create deceptive explanations,
we alter explanations originating from GradCAM, a state-of-art technique for
creating explanations in neural networks. We evaluate the effectiveness of
deceptive explanations on 200 participants. Our findings indicate that
deceptive explanations can indeed fool humans. Our classifier can detect even
seemingly minor attempts of deception with accuracy that exceeds 80\% given
sufficient domain knowledge encoded in the form of training data.",cs.LG,"stat.ML, cs.AI, cs.LG",3,Machine Learning,"Machine Learning, Artificial Intelligence, Machine Learning",Christian Meske,"Johannes Schneider, Joshua Handali, Michalis Vlachos, Christian Meske",4,http://arxiv.org/pdf/2001.07641v1,http://arxiv.org/abs/2001.07641v1,2020-01-21
"Improving Interaction Quality Estimation with BiLSTMs and the Impact on
  Dialogue Policy Learning","Learning suitable and well-performing dialogue behaviour in statistical
spoken dialogue systems has been in the focus of research for many years. While
most work which is based on reinforcement learning employs an objective measure
like task success for modelling the reward signal, we use a reward based on
user satisfaction estimation. We propose a novel estimator and show that it
outperforms all previous estimators while learning temporal dependencies
implicitly. Furthermore, we apply this novel user satisfaction estimation model
live in simulated experiments where the satisfaction estimation model is
trained on one domain and applied in many other domains which cover a similar
task. We show that applying this model results in higher estimated
satisfaction, similar task success rates and a higher robustness to noise.",cs.CL,"stat.ML, cs.AI, cs.CL",3,Computation and Language,"Machine Learning, Artificial Intelligence, Computation and Language",Stefan Ultes,Stefan Ultes,1,http://arxiv.org/pdf/2001.07615v1,http://arxiv.org/abs/2001.07615v1,2020-01-21
Turing analogues of Gödel statements and computability of intelligence,"We show that there is a mathematical obstruction to complete Turing
computability of intelligence. This obstruction can be circumvented only if
human reasoning is fundamentally unsound. The most compelling original argument
for existence of such an obstruction was proposed by Penrose, however G\""odel,
Turing and Lucas have also proposed such arguments. We first partially
reformulate the argument of Penrose. In this formulation we argue that his
argument works up to possibility of construction of a certain G\""odel
statement. We then completely re-frame the argument in the language of Turing
machines, and by partially defining our subject just enough, we show that a
certain analogue of a G\""odel statement, or a G\""odel string as we call it in
the language of Turing machines, can be readily constructed directly, without
appeal to the G\""odel incompleteness theorem, and thus removing the final
objection.",cs.LO,"cs.LO, cs.AI",2,Logic in Computer Science,"Logic in Computer Science, Artificial Intelligence",Yasha Savelyev,Yasha Savelyev,1,http://arxiv.org/pdf/2001.07592v1,http://arxiv.org/abs/2001.07592v1,2020-01-21
Adequate and fair explanations,"Explaining sophisticated machine-learning based systems is an important issue
at the foundations of AI. Recent efforts have shown various methods for
providing explanations. These approaches can be broadly divided into two
schools: those that provide a local and human interpreatable approximation of a
machine learning algorithm, and logical approaches that exactly characterise
one aspect of the decision. In this paper we focus upon the second school of
exact explanations with a rigorous logical foundation. There is an
epistemological problem with these exact methods. While they can furnish
complete explanations, such explanations may be too complex for humans to
understand or even to write down in human readable form. Interpretability
requires epistemically accessible explanations, explanations humans can grasp.
Yet what is a sufficiently complete epistemically accessible explanation still
needs clarification. We do this here in terms of counterfactuals, following
[Wachter et al., 2017]. With counterfactual explanations, many of the
assumptions needed to provide a complete explanation are left implicit. To do
so, counterfactual explanations exploit the properties of a particular data
point or sample, and as such are also local as well as partial explanations. We
explore how to move from local partial explanations to what we call complete
local explanations and then to global ones. But to preserve accessibility we
argue for the need for partiality. This partiality makes it possible to hide
explicit biases present in the algorithm that may be injurious or unfair.We
investigate how easy it is to uncover these biases in providing complete and
fair explanations by exploiting the structure of the set of counterfactuals
providing a complete local explanation.",cs.AI,"cs.AI, I.2.0",2,Artificial Intelligence,Artificial Intelligence,Chris Russell,"Nicholas Asher, Soumya Paul, Chris Russell",3,http://arxiv.org/pdf/2001.07578v1,http://arxiv.org/abs/2001.07578v1,2020-01-21
Implementations in Machine Ethics: A Survey,"Increasingly complex and autonomous systems require machine ethics to
maximize the benefits and minimize the risks to society arising from the new
technology. It is challenging to decide which type of ethical theory to employ
and how to implement it effectively. This survey provides a threefold
contribution. Firstly, it introduces a taxonomy to analyze the field of machine
ethics from an ethical, implementational, and technical perspective. Secondly,
an exhaustive selection and description of relevant works is presented.
Thirdly, applying the new taxonomy to the selected works, dominant research
patterns and lessons for the field are identified, and future directions for
research are suggested.",cs.AI,cs.AI,1,Artificial Intelligence,Artificial Intelligence,Abraham Bernstein,"Suzanne Tolmeijer, Markus Kneer, Cristina Sarasua, Markus Christen, Abraham Bernstein",5,http://arxiv.org/pdf/2001.07573v1,http://arxiv.org/abs/2001.07573v1,2020-01-21
Provenance for the Description Logic ELHr,"We address the problem of handling provenance information in ELHr ontologies.
We consider a setting recently introduced for ontology-based data access, based
on semirings and extending classical data provenance, in which ontology axioms
are annotated with provenance tokens. A consequence inherits the provenance of
the axioms involved in deriving it, yielding a provenance polynomial as an
annotation. We analyse the semantics for the ELHr case and show that the
presence of conjunctions poses various difficulties for handling provenance,
some of which are mitigated by assuming multiplicative idempotency of the
semiring. Under this assumption, we study three problems: ontology completion
with provenance, computing the set of relevant axioms for a consequence, and
query answering.",cs.LO,"cs.LO, cs.AI, 16Y60",3,Logic in Computer Science,"Logic in Computer Science, Artificial Intelligence",Livia Predoiu,"Camille Bourgaux, Ana Ozaki, Rafael Peñaloza, Livia Predoiu",4,http://arxiv.org/pdf/2001.07541v1,http://arxiv.org/abs/2001.07541v1,2020-01-21
AI Trust in business processes: The need for process-aware explanations,"Business processes underpin a large number of enterprise operations including
processing loan applications, managing invoices, and insurance claims. There is
a large opportunity for infusing AI to reduce cost or provide better customer
experience, and the business process management (BPM) literature is rich in
machine learning solutions including unsupervised learning to gain insights on
clusters of process traces, classification models to predict the outcomes,
duration, or paths of partial process traces, extracting business process from
documents, and models to recommend how to optimize a business process or
navigate decision points. More recently, deep learning models including those
from the NLP domain have been applied to process predictions.
  Unfortunately, very little of these innovations have been applied and adopted
by enterprise companies. We assert that a large reason for the lack of adoption
of AI models in BPM is that business users are risk-averse and do not
implicitly trust AI models. There has, unfortunately, been little attention
paid to explaining model predictions to business users with process context. We
challenge the BPM community to build on the AI interpretability literature, and
the AI Trust community to understand",cs.AI,cs.AI,1,Artificial Intelligence,Artificial Intelligence,Vinod Muthusamy,"Steve T. K. Jan, Vatche Ishakian, Vinod Muthusamy",3,http://arxiv.org/pdf/2001.07537v1,http://arxiv.org/abs/2001.07537v1,2020-01-21
Domain-Aware Dialogue State Tracker for Multi-Domain Dialogue Systems,"In task-oriented dialogue systems the dialogue state tracker (DST) component
is responsible for predicting the state of the dialogue based on the dialogue
history. Current DST approaches rely on a predefined domain ontology, a fact
that limits their effective usage for large scale conversational agents, where
the DST constantly needs to be interfaced with ever-increasing services and
APIs. Focused towards overcoming this drawback, we propose a domain-aware
dialogue state tracker, that is completely data-driven and it is modeled to
predict for dynamic service schemas. The proposed model utilizes domain and
slot information to extract both domain and slot specific representations for a
given dialogue, and then uses such representations to predict the values of the
corresponding slot. Integrating this mechanism with a pretrained language model
(i.e. BERT), our approach can effectively learn semantic relations.",cs.CL,"cs.AI, cs.CL",2,Computation and Language,"Artificial Intelligence, Computation and Language",Bernardo Magnini,"Vevake Balaraman, Bernardo Magnini",2,http://arxiv.org/pdf/2001.07526v1,http://arxiv.org/abs/2001.07526v1,2020-01-21
"Combining Federated and Active Learning for Communication-efficient
  Distributed Failure Prediction in Aeronautics","Machine Learning has proven useful in the recent years as a way to achieve
failure prediction for industrial systems. However, the high computational
resources necessary to run learning algorithms are an obstacle to its
widespread application. The sub-field of Distributed Learning offers a solution
to this problem by enabling the use of remote resources but at the expense of
introducing communication costs in the application that are not always
acceptable. In this paper, we propose a distributed learning approach able to
optimize the use of computational and communication resources to achieve
excellent learning model performances through a centralized architecture. To
achieve this, we present a new centralized distributed learning algorithm that
relies on the learning paradigms of Active Learning and Federated Learning to
offer a communication-efficient method that offers guarantees of model
precision on both the clients and the central server. We evaluate this method
on a public benchmark and show that its performances in terms of precision are
very close to state-of-the-art performance level of non-distributed learning
despite additional constraints.",cs.AI,"cs.AI, cs.DC",2,Artificial Intelligence,"Artificial Intelligence, Distributed, Parallel, and Cluster Computing",Yohan Petetin,"Nicolas Aussel, Sophie Chabridon, Yohan Petetin",3,http://arxiv.org/pdf/2001.07504v1,http://arxiv.org/abs/2001.07504v1,2020-01-21
Unsupervisedly Learned Representations: Should the Quest be Over?,"There exists a Classification accuracy gap of about 20% between our best
methods of generating Unsupervisedly Learned Representations and the accuracy
rates achieved by (naturally Unsupervisedly Learning) humans. We are at our
fourth decade at least in search of this class of paradigms. It thus may well
be that we are looking in the wrong direction. We present in this paper a
possible solution to this puzzle. We demonstrate that Reinforcement Learning
schemes can learn representations, which may be used for Pattern Recognition
tasks such as Classification, achieving practically the same accuracy as that
of humans. Our main modest contribution lies in the observations that: a. when
applied to a real world environment (e.g. nature itself) Reinforcement Learning
does not require labels, and thus may be considered a natural candidate for the
long sought, accuracy competitive Unsupervised Learning method, and b. in
contrast, when Reinforcement Learning is applied in a simulated or symbolic
processing environment (e.g. a computer program) it does inherently require
labels and should thus be generally classified, with some exceptions, as
Supervised Learning. The corollary of these observations is that further search
for Unsupervised Learning competitive paradigms which may be trained in
simulated environments like many of those found in research and applications
may be futile.",cs.LG,"cs.AI, cs.LG",2,Machine Learning,"Artificial Intelligence, Machine Learning",Daniel N. Nissani,Daniel N. Nissani,1,http://arxiv.org/pdf/2001.07495v1,http://arxiv.org/abs/2001.07495v1,2020-01-21
Fast Sequence-Based Embedding with Diffusion Graphs,"A graph embedding is a representation of graph vertices in a low-dimensional
space, which approximately preserves properties such as distances between
nodes. Vertex sequence-based embedding procedures use features extracted from
linear sequences of nodes to create embeddings using a neural network. In this
paper, we propose diffusion graphs as a method to rapidly generate vertex
sequences for network embedding. Its computational efficiency is superior to
previous methods due to simpler sequence generation, and it produces more
accurate results. In experiments, we found that the performance relative to
other methods improves with increasing edge density in the graph. In a
community detection task, clustering nodes in the embedding space produces
better results compared to other sequence-based embedding methods.",cs.LG,"cs.SI, cs.DC, stat.ML, cs.LG",4,Machine Learning,"Social and Information Networks, Distributed, Parallel, and Cluster Computing, Machine Learning, Machine Learning",Rik Sarkar,"Benedek Rozemberczki, Rik Sarkar",2,http://arxiv.org/pdf/2001.07463v1,http://arxiv.org/abs/2001.07463v1,2020-01-21
Designing for the Long Tail of Machine Learning,"Recent technical advances has made machine learning (ML) a promising
component to include in end user facing systems. However, user experience (UX)
practitioners face challenges in relating ML to existing user-centered design
processes and how to navigate the possibilities and constraints of this design
space. Drawing on our own experience, we characterize designing within this
space as navigating trade-offs between data gathering, model development and
designing valuable interactions for a given model performance. We suggest that
the theoretical description of how machine learning performance scales with
training data can guide designers in these trade-offs as well as having
implications for prototyping. We exemplify the learning curve's usage by
arguing that a useful pattern is to design an initial system in a bootstrap
phase that aims to exploit the training effect of data collected at increasing
orders of magnitude.",cs.HC,"cs.AI, cs.HC, cs.LG",3,Human-Computer Interaction,"Artificial Intelligence, Human-Computer Interaction, Machine Learning",Jesper Molin,"Martin Lindvall, Jesper Molin",2,http://arxiv.org/pdf/2001.07455v1,http://arxiv.org/abs/2001.07455v1,2020-01-21
"Learning Diverse Features with Part-Level Resolution for Person
  Re-Identification","Learning diverse features is key to the success of person re-identification.
Various part-based methods have been extensively proposed for learning local
representations, which, however, are still inferior to the best-performing
methods for person re-identification. This paper proposes to construct a strong
lightweight network architecture, termed PLR-OSNet, based on the idea of
Part-Level feature Resolution over the Omni-Scale Network (OSNet) for achieving
feature diversity. The proposed PLR-OSNet has two branches, one branch for
global feature representation and the other branch for local feature
representation. The local branch employs a uniform partition strategy for
part-level feature resolution but produces only a single identity-prediction
loss, which is in sharp contrast to the existing part-based methods. Empirical
evidence demonstrates that the proposed PLR-OSNet achieves state-of-the-art
performance on popular person Re-ID datasets, including Market1501,
DukeMTMC-reID and CUHK03, despite its small model size.",cs.CV,"cs.CV, cs.LG",2,Computer Vision and Pattern Recognition,"Computer Vision and Pattern Recognition, Machine Learning",Ming Li,"Ben Xie, Xiaofu Wu, Suofei Zhang, Shiliang Zhao, Ming Li",5,http://arxiv.org/pdf/2001.07442v1,http://arxiv.org/abs/2001.07442v1,2020-01-21
"Explaining Data-Driven Decisions made by AI Systems: The Counterfactual
  Approach","Lack of understanding of the decisions made by model-based AI systems is an
important barrier for their adoption. We examine counterfactual explanations as
an alternative for explaining AI decisions. The counterfactual approach defines
an explanation as a set of the system's data inputs that causally drives the
decision (meaning that removing them changes the decision) and is irreducible
(meaning that removing any subset of the inputs in the explanation does not
change the decision). We generalize previous work on counterfactual
explanations, resulting in a framework that (a) is model-agnostic, (b) can
address features with arbitrary data types, (c) is able explain decisions made
by complex AI systems that incorporate multiple models, and (d) is scalable to
large numbers of features. We also propose a heuristic procedure to find the
most useful explanations depending on the context. We contrast counterfactual
explanations with another alternative: methods that explain model predictions
by weighting features according to their importance (e.g., SHAP, LIME). This
paper presents two fundamental reasons why explaining model predictions is not
the same as explaining the decisions made using those predictions, suggesting
we should carefully consider whether importance-weight explanations are
well-suited to explain decisions made by AI systems. Specifically, we show that
(1) features that have a large importance weight for a model prediction may not
actually affect the corresponding decision, and (2) importance weights are
insufficient to communicate whether and how features influence system
decisions. We demonstrate this using several examples, including three detailed
studies using real-world data that compare the counterfactual approach with
SHAP and illustrate various conditions under which counterfactual explanations
explain data-driven decisions better than feature importance weights.",cs.LG,"stat.ML, cs.AI, cs.LG",3,Machine Learning,"Machine Learning, Artificial Intelligence, Machine Learning",Xintian Han,"Carlos Fernandez, Foster Provost, Xintian Han",3,http://arxiv.org/pdf/2001.07417v1,http://arxiv.org/abs/2001.07417v1,2020-01-21
A multi-agent ontologies-based clinical decision support system,"Clinical decision support systems combine knowledge and data from a variety
of sources, represented by quantitative models based on stochastic methods, or
qualitative based rather on expert heuristics and deductive reasoning. At the
same time, case-based reasoning (CBR) memorizes and returns the experience of
solving similar problems. The cooperation of heterogeneous clinical knowledge
bases (knowledge objects, semantic distances, evaluation functions, logical
rules, databases...) is based on medical ontologies. A multi-agent decision
support system (MADSS) enables the integration and cooperation of agents
specialized in different fields of knowledge (semiology, pharmacology, clinical
cases, etc.). Each specialist agent operates a knowledge base defining the
conduct to be maintained in conformity with the state of the art associated
with an ontological basis that expresses the semantic relationships between the
terms of the domain in question. Our approach is based on the specialization of
agents adapted to the knowledge models used during the clinical steps and
ontologies. This modular approach is suitable for the realization of MADSS in
many areas.",cs.AI,cs.AI,1,Artificial Intelligence,Artificial Intelligence,Joël Colloc,"Ying Shen, Jacquet-Andrieu Armelle, Joël Colloc",3,http://arxiv.org/pdf/2001.07374v1,http://arxiv.org/abs/2001.07374v1,2020-01-21
"FixMatch: Simplifying Semi-Supervised Learning with Consistency and
  Confidence","Semi-supervised learning (SSL) provides an effective means of leveraging
unlabeled data to improve a model's performance. In this paper, we demonstrate
the power of a simple combination of two common SSL methods: consistency
regularization and pseudo-labeling. Our algorithm, FixMatch, first generates
pseudo-labels using the model's predictions on weakly-augmented unlabeled
images. For a given image, the pseudo-label is only retained if the model
produces a high-confidence prediction. The model is then trained to predict the
pseudo-label when fed a strongly-augmented version of the same image. Despite
its simplicity, we show that FixMatch achieves state-of-the-art performance
across a variety of standard semi-supervised learning benchmarks, including
94.93% accuracy on CIFAR-10 with 250 labels and 88.61% accuracy with 40 -- just
4 labels per class. Since FixMatch bears many similarities to existing SSL
methods that achieve worse performance, we carry out an extensive ablation
study to tease apart the experimental factors that are most important to
FixMatch's success. We make our code available at
https://github.com/google-research/fixmatch.",cs.LG,"stat.ML, cs.CV, cs.LG",3,Machine Learning,"Machine Learning, Computer Vision and Pattern Recognition, Machine Learning",Colin Raffel,"Kihyuk Sohn, David Berthelot, Chun-Liang Li, Zizhao Zhang, Nicholas Carlini, Ekin D. Cubuk, Alex Kurakin, Han Zhang, Colin Raffel",9,http://arxiv.org/pdf/2001.07685v1,http://arxiv.org/abs/2001.07685v1,2020-01-21
